study,comparison,log2fc,lfcSE,padj,sample_type,origin,genotype,organism,simple_label
GSE53356,Senescent1_vs_Control1,-1.124,0.512,p=0.03969,human IMR90 cell line,in vitro,wildtype,human,Fibroblasts
GSE101750,Senescent1_vs_Control1,-0.337,1.387,N.S.,human IMR90 fibroblasts,in vitro,wildtype,human,Fibroblasts
GSE105937,Senescent1_vs_Control1,3.032,1.95,N.S.,human IMR90 lung fibroblasts,in vitro,wildtype,human,Fibroblasts
GSE105937,Senescent2_vs_Control1,6.353,1.765,p=0.00144,human IMR90 lung fibroblasts,in vitro,wildtype,human,Fibroblasts
GSE108278,Senescent1_vs_Control1,-3.985,3.213,N.S.,IMR90 hTERT lung fibroblast,in vitro,wildtype,human,Fibroblasts
GSE109700,Senescent1_vs_Control1,-0.881,0.827,N.S.,human lung fibroblast cells,in vitro,wildtype,human,Fibroblasts
GSE118583,Senescent1_vs_Control1,-1.867,1.602,N.S.,human lung fibroblast cell line IMR-90,in vitro,wildtype,human,Fibroblasts
GSE128420,Senescent1_vs_Control1,-3.78,0.605,p<0.00001,primary normal human prostate stromal cells,in vitro,wildtype,human,Stromal
GSE130306,Senescent1_vs_Control1,-3.414,2.002,N.S.,human WI-38 fibroblasts,in vitro,wildtype,human,Fibroblasts
GSE132204,Senescent1_vs_Control1,-1.757,0.971,N.S.,primary human corneal endothelial cells,in vitro,wildtype,human,Endothelial
GSE132204,Senescent2_vs_Control2,-1.983,0.907,N.S.,primary human corneal endothelial cells,in vitro,wildtype,human,Endothelial
GSE132370,Senescent1_vs_Control1,-0.291,0.884,N.S.,human IMR90 fibroblasts,in vitro,wildtype,human,Fibroblasts
GSE155680,Senescent1_vs_Control1,-1,0.898,N.S.,primary human umbilical vein endothelial cells,in vitro,wildtype,human,Endothelial
GSE156038,Senescent1_vs_Control1,3.379,1.241,p=0.01304,human prostate primary stromal cells,in vitro,wildtype,human,Stromal
GSE156184,Senescent1_vs_Control1,3.378,1.241,p=0.01274,Normal human prostate derived primary stromal cells,in vitro,wildtype,human,Stromal
GSE156472,Senescent1_vs_Control1,3.379,1.241,p=0.01274,primary human prostate stromal cells,in vitro,wildtype,human,Stromal
GSE157867,Senescent1_vs_Control1,-0.745,0.886,N.S.,human umbilical vein endothelial cell,in vitro,wildtype,human,Endothelial
GSE165406,Senescent1_vs_Control1,1.414,0.542,p=0.03034,human umbilical vein endothelial cells,in vitro,c1 wildtype; s1 genetically edited (siRNA knockdown of CCM2),human,Endothelial
GSE166035,Senescent1_vs_Control1,-0.022,0.579,N.S.,primary small airway epithelial cells,in vitro,wildtype,human,Epithelial
GSE166035,Senescent2_vs_Control2,-1.912,0.525,p=0.00063,primary small airway epithelial cells,in vitro,wildtype,human,Epithelial
GSE166059,Senescent1_vs_Control1,-0.025,0.595,N.S.,human SAEC cells,in vitro,wildtype,human,Other
GSE166059,Senescent2_vs_Control2,-1.502,0.625,p=0.02693,human SAEC cells,in vitro,wildtype,human,Other
GSE168994,Senescent1_vs_Control1,-3.328,1.69,N.S.,human lung fibroblast,in vitro,wildtype,human,Fibroblasts
GSE171780,Senescent1_vs_Control1,-4.299,2.039,N.S.,human fibroblast cell line IMR90,in vitro,wildtype,human,Fibroblasts
GSE176199,Senescent1_vs_Control1,-0.473,0.577,N.S.,human cartilage mesenchymal stromal cells,in vitro,wildtype,human,Chondrocytes
GSE176324,Senescent1_vs_Control1,0.218,0.927,N.S.,primary human pancreatic islets,in vitro,wildtype,human,Pancreatic
GSE180361,Senescent1_vs_Control1,-1.549,0.948,N.S.,human IMR90 fibroblasts,in vitro,s1 p16 overexpression; c1 wildtype,human,Fibroblasts
GSE180361,Senescent2_vs_Control2,-0.371,0.625,N.S.,human keratinocytes,in vitro,s2 HRAS G12V overexpression; c2 wildtype,human,Epithelial
GSE180406,Senescent1_vs_Control1,-1.245,0.948,N.S.,human MRC-5 cell line,in vitro,wildtype,human,Other
GSE184892,Senescent1_vs_Control1,0.678,0.9,N.S.,human primary fibroblast,in vitro,wildtype,human,Fibroblasts
GSE198396,Senescent1_vs_Control1,-1.612,0.396,p=0.00021,human foreskin fibroblast cell line HCA2,in vitro,wildtype,human,Fibroblasts
GSE214409,Senescent1_vs_Control1,-1.28,1.2,N.S.,primary human IMR90 fibroblasts,in vitro,c1 wildtype; s1 HRasV12 overexpression,human,Fibroblasts
GSE221104,Senescent1_vs_Control1,-0.547,1.095,N.S.,human WI-38 fibroblast cell line,in vitro,wildtype,human,Fibroblasts
GSE226005,Senescent1_vs_Control1,0.951,1.261,N.S.,fibroblast cell line,in vitro,wildtype,human,Fibroblasts
GSE234417,Senescent1_vs_Control1,-3.345,1.84,N.S.,WI-38 cells,in vitro,wildtype,human,Fibroblasts
GSE238254,Senescent1_vs_Control1,0.229,1.174,N.S.,human lung fibroblast,in vitro,wildtype,human,Fibroblasts
GSE250224,Senescent1_vs_Control1,-0.895,0.543,N.S.,human corneal endothelial cell,in vitro,wildtype,human,Endothelial
GSE250224,Senescent2_vs_Control1,-1.395,0.572,p=0.03522,human corneal endothelial cell,in vitro,wildtype,human,Endothelial
GSE251814,Senescent1_vs_Control1,-0.334,0.276,N.S.,human induced pluripotent stem cells,in vitro,genetically edited (inducible CRISPRi targeting TERF2),human,Other
GSE264316,Senescent1_vs_Control1,-0.235,1.21,N.S.,human primary prostate stromal cell line,in vitro,wildtype,human,Stromal
GSE268487,Senescent1_vs_Control1,-0.816,0.922,N.S.,human lung fibroblasts,in vitro,wildtype,human,Fibroblasts
GSE269856,Senescent1_vs_Control1,-0.433,0.95,N.S.,human primary lung fibroblasts,in vitro,wildtype,human,Fibroblasts
GSE274295,Senescent1_vs_Control1,-2.847,1.345,N.S.,Human embryonic lung fibroblasts,in vitro,wildtype,human,Fibroblasts
GSE275256,Senescent1_vs_Control1,0.834,0.721,N.S.,human immortalized microglia cell line,in vitro,wildtype,human,Neural
GSE280365,Senescent1_vs_Control1,0.223,0.795,N.S.,lung fibroblasts,in vitro,WT,human,Fibroblasts
GSE287646,Senescent1_vs_Control1,0.228,0.612,N.S.,human ASC52telo mesenchymal stem cells,in vitro,wildtype,human,Stromal
GSE60340,Senescent2_vs_Control1,4.832,1.387,p=0.00124,MDAH041 LFS fibroblasts,in vitro,wildtype,human,Fibroblasts
GSE61130,Senescent1_vs_Control1,-0.427,1.681,N.S.,human IMR90 fibroblasts,in vitro,wildtype,human,Fibroblasts
GSE63577,Senescent3_vs_Control3,-3.158,0.874,p=0.00150,human HFF fibroblasts,in vitro,wildtype,human,Fibroblasts
GSE94280,Senescent1_vs_Control1,-0.997,1.025,N.S.,human BJ fibroblast,in vitro,wildtype,human,Fibroblasts
GSE133292,Senescent1_vs_Control1,0.944,1.571,N.S.,human foreskin fibroblasts,in vitro,wildtype,human,Fibroblasts
GSE155371,Senescent1_vs_Control1,-1.228,0.633,N.S.,primary human oral keratinocytes,in vitro,wildtype,human,Epithelial
GSE165532,Senescent2_vs_Control2,-0.853,0.956,N.S.,human WI-38 fibroblast cell line,in vitro,wildtype,human,Fibroblasts
GSE230181,Senescent1_vs_Control1,-1.054,0.383,p=0.02003,s1 IMR90 cell line; s1 ADSC; c1 ADSC; s1 RPTEC; c1 RPTEC; s1 HUVEC; c1 HUVEC; s1 HMVEC; c1 HMVEC,in vitro,wildtype,human,Fibroblasts
GSE230181,Senescent8_vs_Control1,-1.992,0.768,p=0.02646,IMR90 cell line,in vitro,wildtype,human,Fibroblasts
GSE230181,Senescent2_vs_Control1,-2.2,0.684,p=0.00359,IMR90 cell line,in vitro,wildtype,human,Fibroblasts
GSE230181,Senescent3_vs_Control1,-1.684,0.6,p=0.01390,IMR90 cell line,in vitro,wildtype,human,Fibroblasts
GSE230181,Senescent4_vs_Control1,-1.378,0.594,p=0.04695,IMR90 cell line,in vitro,wildtype,human,Fibroblasts
GSE230181,Senescent6_vs_Control1,-4.398,1.294,p=0.00303,IMR90 cell line,in vitro,wildtype,human,Fibroblasts
GSE230181,Senescent7_vs_Control1,-2.111,0.649,p=0.00351,IMR90 cell line,in vitro,wildtype,human,Fibroblasts
GSE230181,Senescent5_vs_Control1,-1.743,0.616,p=0.01292,IMR90 cell line,in vitro,wildtype,human,Fibroblasts
GSE230181,Senescent9_vs_Control1,-2.449,0.732,p=0.00293,IMR90 cell line,in vitro,wildtype,human,Fibroblasts
GSE230358,Senescent1_vs_Control1,-0.737,0.383,N.S.,human IMR90 fibroblast cell line,in vitro,wildtype,human,Fibroblasts
GSE230358,Senescent8_vs_Control1,-2.282,1.067,N.S.,human IMR90 fibroblast cell line,in vitro,wildtype,human,Fibroblasts
GSE230358,Senescent2_vs_Control1,-1.297,0.876,N.S.,human IMR90 fibroblast cell line,in vitro,wildtype,human,Fibroblasts
GSE230358,Senescent3_vs_Control1,-2.81,1.225,N.S.,human IMR90 fibroblast cell line,in vitro,wildtype,human,Fibroblasts
GSE230358,Senescent4_vs_Control1,-1.011,0.638,N.S.,human IMR90 fibroblast cell line,in vitro,wildtype,human,Fibroblasts
GSE230358,Senescent6_vs_Control1,-0.381,0.838,N.S.,human IMR90 fibroblast cell line,in vitro,wildtype,human,Fibroblasts
GSE230358,Senescent7_vs_Control1,-2.009,0.758,p=0.03628,human IMR90 fibroblast cell line,in vitro,wildtype,human,Fibroblasts
GSE230358,Senescent5_vs_Control1,-0.85,0.784,N.S.,human IMR90 fibroblast cell line,in vitro,wildtype,human,Fibroblasts
GSE230358,Senescent9_vs_Control1,-1.194,0.656,N.S.,human IMR90 fibroblast cell line,in vitro,wildtype,human,Fibroblasts
GSE295083,Senescent1_vs_Control1,2.354,1.008,p=0.04261,human primary fibroblasts,in vitro,wildtype,human,Fibroblasts
GSE296209,Senescent1_vs_Control1,-0.076,0.419,N.S.,human primary prostate stromal cells,in vitro,wildtype,human,Stromal
GSE84694,Senescent1_vs_Control1,-1.228,1.209,N.S.,human mesenchymal stem cells,in vitro,wildtype,human,Stromal
GSE85082,Senescent1_vs_Control1,0.463,1.664,N.S.,unknown,in vitro,wildtype,human,Other
GSE216842,Senescent1_vs_Control1,-0.415,0.69,N.S.,human primary stromal cell line,in vitro,wildtype,human,Stromal
GSE216842,Senescent2_vs_Control2,0.674,0.784,N.S.,human primary stromal cell line,in vitro,wildtype,human,Stromal
GSE216842,Senescent4_vs_Control4,1.496,0.709,N.S.,human primary stromal cell line,in vitro,wildtype,human,Stromal
GSE280050,Senescent1_vs_Control1,0.669,0.633,N.S.,human cardiac organoids,in vitro,wildtype,human,Other
