study,comparison,log2fc,lfcSE,padj,sample_type,origin,genotype,organism,simple_label
GSE53356,Senescent1_vs_Control1,1.073,0.05,p<0.00001,human IMR90 cell line,in vitro,wildtype,human,Fibroblasts
GSE247607,human_Senescent1_vs_Control1,0.304,0.141,N.S.,human IMR-90 fibroblast cell line,in vitro,wildtype,human,Fibroblasts
GSE101750,Senescent1_vs_Control1,-0.769,0.22,p=0.00162,human IMR90 fibroblasts,in vitro,wildtype,human,Fibroblasts
GSE103938,Senescent2_vs_Control1,0.04,0.4,N.S.,human IMR90 fibroblasts,in vitro,wildtype,human,Fibroblasts
GSE105937,Senescent1_vs_Control1,0.785,0.247,p=0.01314,human IMR90 lung fibroblasts,in vitro,wildtype,human,Fibroblasts
GSE105937,Senescent2_vs_Control1,-0.23,0.227,N.S.,human IMR90 lung fibroblasts,in vitro,wildtype,human,Fibroblasts
GSE108278,Senescent1_vs_Control1,0.789,0.169,p=0.00001,IMR90 hTERT lung fibroblast,in vitro,wildtype,human,Fibroblasts
GSE109700,Senescent1_vs_Control1,0.498,0.345,N.S.,human lung fibroblast cells,in vitro,wildtype,human,Fibroblasts
GSE118583,Senescent1_vs_Control1,2.013,0.104,p<0.00001,human lung fibroblast cell line IMR-90,in vitro,wildtype,human,Fibroblasts
GSE124609,Senescent1_vs_Control1,-0.021,0.243,N.S.,human lung fibroblasts,in vitro,wildtype,human,Fibroblasts
GSE125632,Senescent1_vs_Control1,1.12,0.588,N.S.,human bone marrow mesenchymal stromal cells,in vitro,wildtype,human,Stromal
GSE128420,Senescent1_vs_Control1,3.07,0.112,p<0.00001,primary normal human prostate stromal cells,in vitro,wildtype,human,Stromal
GSE130306,Senescent1_vs_Control1,1.595,0.142,p<0.00001,human WI-38 fibroblasts,in vitro,wildtype,human,Fibroblasts
GSE132204,Senescent1_vs_Control1,-0.323,0.38,N.S.,primary human corneal endothelial cells,in vitro,wildtype,human,Endothelial
GSE132204,Senescent2_vs_Control2,1.009,0.38,p=0.03063,primary human corneal endothelial cells,in vitro,wildtype,human,Endothelial
GSE132370,Senescent1_vs_Control1,0.787,0.363,N.S.,human IMR90 fibroblasts,in vitro,wildtype,human,Fibroblasts
GSE144752,Senescent1_vs_Control1,-0.009,0.107,N.S.,BJ hTERT fibroblast,in vitro,wildtype,human,Fibroblasts
GSE153921,Senescent1_vs_Control1,-0.147,0.228,N.S.,human IMR90 ER:RAS cell line,in vitro,genetically edited (shRNA knockdown of XPO7),human,Fibroblasts
GSE155680,Senescent1_vs_Control1,0.66,0.077,p<0.00001,primary human umbilical vein endothelial cells,in vitro,wildtype,human,Endothelial
GSE155903,Senescent1_vs_Control1,-0.463,0.194,p=0.03705,IMR90 ER:RAS cell line,in vitro,genetically edited (ER:RAS),human,Fibroblasts
GSE156038,Senescent1_vs_Control1,-1.224,0.1,p<0.00001,human prostate primary stromal cells,in vitro,wildtype,human,Stromal
GSE156184,Senescent1_vs_Control1,-1.225,0.1,p<0.00001,Normal human prostate derived primary stromal cells,in vitro,wildtype,human,Stromal
GSE156472,Senescent1_vs_Control1,-1.225,0.1,p<0.00001,primary human prostate stromal cells,in vitro,wildtype,human,Stromal
GSE157867,Senescent1_vs_Control1,0.496,0.245,N.S.,human umbilical vein endothelial cell,in vitro,wildtype,human,Endothelial
GSE160273,Senescent1_vs_Control1,1.277,0.119,p<0.00001,human bone mesenchymal stem cells,in vitro,wildtype,human,Stromal
GSE160702,Senescent1_vs_Control1,0.473,0.187,N.S.,human endometrial stromal cells,in vitro,wildtype,human,Stromal
GSE165406,Senescent1_vs_Control1,-0.027,0.198,N.S.,human umbilical vein endothelial cells,in vitro,c1 wildtype; s1 genetically edited (siRNA knockdown of CCM2),human,Endothelial
GSE166035,Senescent1_vs_Control1,0.278,0.131,N.S.,primary small airway epithelial cells,in vitro,wildtype,human,Epithelial
GSE166035,Senescent2_vs_Control2,0.92,0.111,p<0.00001,primary small airway epithelial cells,in vitro,wildtype,human,Epithelial
GSE166059,Senescent1_vs_Control1,0.276,0.115,p=0.03674,human SAEC cells,in vitro,wildtype,human,Other
GSE166059,Senescent2_vs_Control2,0.791,0.111,p<0.00001,human SAEC cells,in vitro,wildtype,human,Other
GSE168994,Senescent1_vs_Control1,1.248,0.101,p<0.00001,human lung fibroblast,in vitro,wildtype,human,Fibroblasts
GSE171780,Senescent1_vs_Control1,-0.237,0.158,N.S.,human fibroblast cell line IMR90,in vitro,wildtype,human,Fibroblasts
GSE176199,Senescent1_vs_Control1,0.175,0.083,N.S.,human cartilage mesenchymal stromal cells,in vitro,wildtype,human,Chondrocytes
GSE176324,Senescent1_vs_Control1,0,0.183,N.S.,primary human pancreatic islets,in vitro,wildtype,human,Pancreatic
GSE180361,Senescent1_vs_Control1,0.1,0.184,N.S.,human IMR90 fibroblasts,in vitro,s1 p16 overexpression; c1 wildtype,human,Fibroblasts
GSE180361,Senescent2_vs_Control2,-0.3,0.129,p=0.04031,human keratinocytes,in vitro,s2 HRAS G12V overexpression; c2 wildtype,human,Epithelial
GSE180406,Senescent1_vs_Control1,-0.542,0.236,p=0.04358,human MRC-5 cell line,in vitro,wildtype,human,Other
GSE184892,Senescent1_vs_Control1,-0.217,0.237,N.S.,human primary fibroblast,in vitro,wildtype,human,Fibroblasts
GSE198396,Senescent1_vs_Control1,-0.257,0.158,N.S.,human foreskin fibroblast cell line HCA2,in vitro,wildtype,human,Fibroblasts
GSE207816,Senescent1_vs_Control1,1.104,0.574,N.S.,human pancreatic beta cells,in vitro,wildtype,human,Pancreatic
GSE214409,Senescent1_vs_Control1,-0.128,0.097,N.S.,primary human IMR90 fibroblasts,in vitro,c1 wildtype; s1 HRasV12 overexpression,human,Fibroblasts
GSE221104,Senescent1_vs_Control1,0.577,0.099,p<0.00001,human WI-38 fibroblast cell line,in vitro,wildtype,human,Fibroblasts
GSE222400,Senescent1_vs_Control1,-0.153,0.31,N.S.,human lung fibroblast cells,in vitro,wildtype,human,Fibroblasts
GSE222400,Senescent2_vs_Control2,-0.229,0.282,N.S.,human lung fibroblast cells,in vitro,wildtype,human,Fibroblasts
GSE226005,Senescent1_vs_Control1,0.572,0.144,p=0.00027,fibroblast cell line,in vitro,wildtype,human,Fibroblasts
GSE234417,Senescent1_vs_Control1,0.13,0.108,N.S.,WI-38 cells,in vitro,wildtype,human,Fibroblasts
GSE235768,Senescent1_vs_Control1,-0.426,0.222,N.S.,human normal skin fibroblasts,in vitro,wildtype,human,Fibroblasts
GSE235768,Senescent2_vs_Control2,-0.525,0.221,N.S.,human normal skin fibroblasts,in vitro,wildtype,human,Fibroblasts
GSE235768,Senescent3_vs_Control3,0.646,0.245,p=0.03700,human normal lung fibroblasts,in vitro,wildtype,human,Fibroblasts
GSE235768,Senescent4_vs_Control4,0.04,0.238,N.S.,human normal lung fibroblasts,in vitro,wildtype,human,Fibroblasts
GSE238252,Senescent1_vs_Control1,0.951,0.517,N.S.,human lung fibroblast,in vitro,wildtype,human,Fibroblasts
GSE238254,Senescent1_vs_Control1,1.07,0.141,p<0.00001,human lung fibroblast,in vitro,wildtype,human,Fibroblasts
GSE245045,Senescent1_vs_Control1,0.216,0.302,N.S.,primary dermal fibroblast,in vitro,wildtype,human,Fibroblasts
GSE245147,Senescent1_vs_Control1,1.199,0.08,p<0.00001,human nucleus pulposus cells,in vitro,wildtype,human,Musculoskeletal
GSE246073,Senescent1_vs_Control1,-0.089,0.506,N.S.,human astrocytes derived from hESC,in vitro,wildtype,human,Neural
GSE250224,Senescent1_vs_Control1,2.611,0.275,p<0.00001,human corneal endothelial cell,in vitro,wildtype,human,Endothelial
GSE250224,Senescent2_vs_Control1,1.468,0.276,p<0.00001,human corneal endothelial cell,in vitro,wildtype,human,Endothelial
GSE251814,Senescent1_vs_Control1,0.464,0.367,N.S.,human induced pluripotent stem cells,in vitro,genetically edited (inducible CRISPRi targeting TERF2),human,Other
GSE264316,Senescent1_vs_Control1,-0.509,0.151,p=0.00176,human primary prostate stromal cell line,in vitro,wildtype,human,Stromal
GSE268487,Senescent1_vs_Control1,0.291,0.212,N.S.,human lung fibroblasts,in vitro,wildtype,human,Fibroblasts
GSE269856,Senescent1_vs_Control1,0.438,0.746,N.S.,human primary lung fibroblasts,in vitro,wildtype,human,Fibroblasts
GSE274295,Senescent1_vs_Control1,0.558,0.127,p=0.00003,Human embryonic lung fibroblasts,in vitro,wildtype,human,Fibroblasts
GSE275256,Senescent1_vs_Control1,0.815,0.177,p=0.00003,human immortalized microglia cell line,in vitro,wildtype,human,Neural
GSE280365,Senescent1_vs_Control1,2.205,0.275,p<0.00001,lung fibroblasts,in vitro,WT,human,Fibroblasts
GSE287646,Senescent1_vs_Control1,0.896,0.204,p=0.00008,human ASC52telo mesenchymal stem cells,in vitro,wildtype,human,Stromal
GSE294733,Senescent1_vs_Control1,0.736,0.234,p=0.00750,human umbilical vein endothelial cells,in vitro,wildtype,human,Endothelial
GSE294733,Senescent2_vs_Control1,0.236,0.236,N.S.,human umbilical vein endothelial cells,in vitro,wildtype,human,Endothelial
GSE56293,Senescent1_vs_Control1,-0.25,0.17,N.S.,human BJ foreskin fibroblasts,in vitro,wildtype,human,Fibroblasts
GSE58910,Senescent1_vs_Control1,0.295,0.22,N.S.,primary human astrocytes,in vitro,wildtype,human,Neural
GSE59966,Senescent1_vs_Control1,0.722,0.199,p=0.00397,human mesenchymal stromal cells,in vitro,wildtype,human,Stromal
GSE60340,Senescent2_vs_Control1,1.288,0.542,p=0.03213,MDAH041 LFS fibroblasts,in vitro,wildtype,human,Fibroblasts
GSE61130,Senescent1_vs_Control1,0.186,0.119,N.S.,human IMR90 fibroblasts,in vitro,wildtype,human,Fibroblasts
GSE63577,Senescent3_vs_Control3,0.571,0.266,N.S.,human HFF fibroblasts,in vitro,wildtype,human,Fibroblasts
GSE75643,Senescent1_vs_Control1,0.094,0.369,N.S.,diploid embryonic lung fibroblasts,in vitro,c1 wildtype; s1 genetically edited (BRAF V600E overexpression),human,Fibroblasts
GSE94280,Senescent1_vs_Control1,-0.023,0.114,N.S.,human BJ fibroblast,in vitro,wildtype,human,Fibroblasts
GSE94395,Senescent1_vs_Control1,0.034,0.16,N.S.,human fibroblasts (IMR90 cell line),in vitro,wildtype,human,Fibroblasts
GSE99028,Senescent1_vs_Control1,-0.14,0.437,N.S.,primary human fibroblasts,in vitro,wildtype,human,Fibroblasts
GSE133292,Senescent1_vs_Control1,0.681,0.204,p=0.00532,human foreskin fibroblasts,in vitro,wildtype,human,Fibroblasts
GSE155371,Senescent1_vs_Control1,2.034,0.511,p=0.00105,primary human oral keratinocytes,in vitro,wildtype,human,Epithelial
GSE165532,Senescent2_vs_Control2,0.936,0.113,p<0.00001,human WI-38 fibroblast cell line,in vitro,wildtype,human,Fibroblasts
GSE230181,Senescent1_vs_Control1,0.612,0.311,N.S.,s1 IMR90 cell line; s1 ADSC; c1 ADSC; s1 RPTEC; c1 RPTEC; s1 HUVEC; c1 HUVEC; s1 HMVEC; c1 HMVEC,in vitro,wildtype,human,Fibroblasts
GSE230181,Senescent8_vs_Control1,0.462,0.523,N.S.,IMR90 cell line,in vitro,wildtype,human,Fibroblasts
GSE230181,Senescent2_vs_Control1,-1.905,0.435,p=0.00005,IMR90 cell line,in vitro,wildtype,human,Fibroblasts
GSE230181,Senescent3_vs_Control1,-0.387,0.433,N.S.,IMR90 cell line,in vitro,wildtype,human,Fibroblasts
GSE230181,Senescent4_vs_Control1,-0.679,0.434,N.S.,IMR90 cell line,in vitro,wildtype,human,Fibroblasts
GSE230181,Senescent6_vs_Control1,0.423,0.523,N.S.,IMR90 cell line,in vitro,wildtype,human,Fibroblasts
GSE230181,Senescent7_vs_Control1,0.318,0.433,N.S.,IMR90 cell line,in vitro,wildtype,human,Fibroblasts
GSE230181,Senescent5_vs_Control1,0.48,0.433,N.S.,IMR90 cell line,in vitro,wildtype,human,Fibroblasts
GSE230181,Senescent9_vs_Control1,-0.158,0.469,N.S.,IMR90 cell line,in vitro,wildtype,human,Fibroblasts
GSE230358,Senescent1_vs_Control1,0.609,0.206,p=0.01611,human IMR90 fibroblast cell line,in vitro,wildtype,human,Fibroblasts
GSE230358,Senescent8_vs_Control1,-1.472,0.41,p=0.00397,human IMR90 fibroblast cell line,in vitro,wildtype,human,Fibroblasts
GSE230358,Senescent2_vs_Control1,-1.678,0.411,p=0.00037,human IMR90 fibroblast cell line,in vitro,wildtype,human,Fibroblasts
GSE230358,Senescent3_vs_Control1,-2.001,0.412,p=0.00001,human IMR90 fibroblast cell line,in vitro,wildtype,human,Fibroblasts
GSE230358,Senescent4_vs_Control1,-0.059,0.33,N.S.,human IMR90 fibroblast cell line,in vitro,wildtype,human,Fibroblasts
GSE230358,Senescent6_vs_Control1,0.091,0.409,N.S.,human IMR90 fibroblast cell line,in vitro,wildtype,human,Fibroblasts
GSE230358,Senescent7_vs_Control1,0.957,0.33,p=0.02027,human IMR90 fibroblast cell line,in vitro,wildtype,human,Fibroblasts
GSE230358,Senescent5_vs_Control1,-0.985,0.409,N.S.,human IMR90 fibroblast cell line,in vitro,wildtype,human,Fibroblasts
GSE230358,Senescent9_vs_Control1,0.933,0.33,p=0.02398,human IMR90 fibroblast cell line,in vitro,wildtype,human,Fibroblasts
GSE295083,Senescent1_vs_Control1,-1.405,0.63,N.S.,human primary fibroblasts,in vitro,wildtype,human,Fibroblasts
GSE296209,Senescent1_vs_Control1,0.738,0.135,p<0.00001,human primary prostate stromal cells,in vitro,wildtype,human,Stromal
GSE76605,Senescent1_vs_Control1,-0.108,0.335,N.S.,unknown,in vitro,c1 wildtype; s1 genetically edited (BRAF overexpression),human,Other
GSE84694,Senescent1_vs_Control1,-0.348,0.353,N.S.,human mesenchymal stem cells,in vitro,wildtype,human,Stromal
GSE85082,Senescent1_vs_Control1,-0.628,0.387,N.S.,unknown,in vitro,wildtype,human,Other
GSE216842,Senescent1_vs_Control1,0.57,0.094,p<0.00001,human primary stromal cell line,in vitro,wildtype,human,Stromal
GSE216842,Senescent2_vs_Control2,0.091,0.096,N.S.,human primary stromal cell line,in vitro,wildtype,human,Stromal
GSE216842,Senescent4_vs_Control4,0.129,0.093,N.S.,human primary stromal cell line,in vitro,wildtype,human,Stromal
GSE252675,Senescent1_vs_Control1,0.153,0.37,N.S.,human nucleus pulposus mesenchymal stem cells,in vitro,wildtype,human,Musculoskeletal
GSE280050,Senescent1_vs_Control1,2.206,0.168,p<0.00001,human cardiac organoids,in vitro,wildtype,human,Other
