study,comparison,log2fc,lfcSE,padj,sample_type,origin,genotype,organism,simple_label
GSE212085,Senescent1_vs_Control1,2.246,2.023,N.S.,human foetal lung fibroblast cell line IMR-90,in vitro,wildtype,human,Fibroblasts
GSE224071,Senescent1_vs_Control1,-5.204,0.712,p<0.00001,human lung fibroblast cell line,in vitro,wildtype,human,Fibroblasts
GSE117208,Senescent1_vs_Control1,1.647,0.756,N.S.,mouse embryonic fibroblasts (MEFs),in vitro,wildtype C57BL/6,mouse,Fibroblasts
GSE117979,Senescent1_vs_Control1,2.528,0.417,p<0.00001,mouse embryonic fibroblasts,in vitro,wildtype C57BL/6,mouse,Fibroblasts
GSE117979,Senescent2_vs_Control2,1.026,0.412,p=0.02758,c2 mouse embryonic fibroblasts; c2 mouse embryonic fibroblata; s2 mouse embryonic fibroblasts,in vitro,wildtype C57BL/6,mouse,Fibroblasts
GSE117979,Senescent3_vs_Control3,3.325,0.416,p<0.00001,mouse embryonic fibroblasts,in vitro,wildtype C57BL/6,mouse,Fibroblasts
GSE139575,Senescent1_vs_Control1,0.57,0.133,p=0.00011,mouse embryonic fibroblasts (MEF),in vitro,c1 wildtype C57BL/6; s1 genetically edited (overexpression of p21),mouse,Fibroblasts
GSE139575,Senescent2_vs_Control1,0.272,0.134,N.S.,mouse embryonic fibroblasts (MEF),in vitro,genetically edited (overexpression of p16),mouse,Fibroblasts
GSE169489,Senescent2_vs_Control1,-0.594,0.457,N.S.,MEF14_Dox+_Day8,in vitro,wildtype,mouse,Fibroblasts
GSE176107,Senescent1_vs_Control1,4.796,0.508,p<0.00001,mouse tail fibroblast,in vitro,wildtype C57BL/6,mouse,Fibroblasts
GSE182731,Senescent2_vs_Control2,-0.169,0.171,N.S.,primary mouse lung fibroblasts,in vitro,wildtype C57BL/6,mouse,Fibroblasts
GSE182731,Senescent3_vs_Control3,1.255,0.199,p<0.00001,primary mouse lung fibroblasts,in vitro,wildtype C57BL/6,mouse,Fibroblasts
GSE202032,Senescent1_vs_Control1,2.24,0.216,p<0.00001,mouse embryonic fibroblasts,in vitro,wildtype,mouse,Fibroblasts
GSE210362,Senescent1_vs_Control1,1.161,0.154,p<0.00001,murine embryonic fibroblasts,in vitro,c1 wildtype; s1 genetically edited (Myc knockout),mouse,Fibroblasts
GSE218683,Senescent1_vs_Control1,-1.026,0.657,N.S.,mouse embryonic fibroblasts,in vitro,wildtype,mouse,Fibroblasts
GSE218683,Senescent2_vs_Control2,-0.5,0.654,N.S.,mouse embryonic fibroblasts,in vitro,wildtype,mouse,Fibroblasts
GSE218684,Senescent1_vs_Control1,1.815,0.365,p=0.00002,mouse embryonic fibroblast,in vitro,wildtype,mouse,Fibroblasts
GSE218684,Senescent2_vs_Control2,1.384,0.356,p=0.00201,mouse embryonic fibroblast,in vitro,wildtype,mouse,Fibroblasts
GSE229010,Senescent1_vs_Control1,4.884,0.163,p<0.00001,primary mouse adult fibroblast,in vitro,wildtype,mouse,Fibroblasts
GSE233718,Senescent1_vs_Control1,1.441,0.55,p=0.02532,mouse proximal tubular epithelial cells,in vitro,wildtype C57BL/6Rj,mouse,Epithelial
GSE247975,Senescent1_vs_Control1,3.366,0.495,p<0.00001,mouse fibro-adipogenic progenitors,in vitro,wildtype C57BL/6,mouse,Stromal
GSE278372,Senescent1_vs_Control1,-0.913,1.383,N.S.,primary mouse embryonic fibroblasts,in vitro,wildtype,mouse,Fibroblasts
GSE278372,Senescent2_vs_Control2,2.792,1.2,N.S.,primary mouse embryonic fibroblasts,in vitro,wildtype,mouse,Fibroblasts
GSE279349,Senescent1_vs_Control1,0.566,1.198,N.S.,primary mouse embryonic fibroblasts,in vitro,wildtype,mouse,Fibroblasts
GSE279349,Senescent2_vs_Control1,0.786,1.198,N.S.,primary mouse embryonic fibroblasts,in vitro,wildtype,mouse,Fibroblasts
GSE281894,Senescent1_vs_Control1,-0.091,1.135,N.S.,podocytes,in vitro,wildtype,mouse,Renal
GSE160279,mouse_Senescent2_vs_Control2,1.151,0.538,N.S.,mouse embryonic fibroblasts,in vitro,wildtype,mouse,Fibroblasts
GSE179880,Senescent1_vs_Control1,0.559,0.156,p=0.00125,mouse skin fibroblasts,in vitro,wildtype,mouse,Fibroblasts
GSE201217,Senescent1_vs_Control1,0.802,3.161,N.S.,primary PWK mouse cells,in vitro,wildtype,mouse,Other
GSE247607,human_Senescent1_vs_Control1,1.514,1.144,N.S.,human IMR-90 fibroblast cell line,in vitro,wildtype,human,Fibroblasts
GSE103938,Senescent2_vs_Control1,-4.815,1.413,p=0.00395,human IMR90 fibroblasts,in vitro,wildtype,human,Fibroblasts
GSE105937,Senescent1_vs_Control1,-1.886,1.037,N.S.,human IMR90 lung fibroblasts,in vitro,wildtype,human,Fibroblasts
GSE105937,Senescent2_vs_Control1,-1.229,0.933,N.S.,human IMR90 lung fibroblasts,in vitro,wildtype,human,Fibroblasts
GSE108278,Senescent1_vs_Control1,3.04,1.99,N.S.,IMR90 hTERT lung fibroblast,in vitro,wildtype,human,Fibroblasts
GSE109700,Senescent1_vs_Control1,-0.885,1.121,N.S.,human lung fibroblast cells,in vitro,wildtype,human,Fibroblasts
GSE118583,Senescent1_vs_Control1,2.693,1.664,N.S.,human lung fibroblast cell line IMR-90,in vitro,wildtype,human,Fibroblasts
GSE125632,Senescent1_vs_Control1,-3.749,1.08,p=0.00868,human bone marrow mesenchymal stromal cells,in vitro,wildtype,human,Stromal
GSE128420,Senescent1_vs_Control1,0.884,1.272,N.S.,primary normal human prostate stromal cells,in vitro,wildtype,human,Stromal
GSE130306,Senescent1_vs_Control1,0.486,0.983,N.S.,human WI-38 fibroblasts,in vitro,wildtype,human,Fibroblasts
GSE132204,Senescent1_vs_Control1,-1.995,0.553,p=0.00313,primary human corneal endothelial cells,in vitro,wildtype,human,Endothelial
GSE132204,Senescent2_vs_Control2,-1.211,0.553,N.S.,primary human corneal endothelial cells,in vitro,wildtype,human,Endothelial
GSE132370,Senescent1_vs_Control1,2.363,1.501,N.S.,human IMR90 fibroblasts,in vitro,wildtype,human,Fibroblasts
GSE153921,Senescent1_vs_Control1,-1.62,1.671,N.S.,human IMR90 ER:RAS cell line,in vitro,genetically edited (shRNA knockdown of XPO7),human,Fibroblasts
GSE156038,Senescent1_vs_Control1,4.38,1.252,p=0.00119,human prostate primary stromal cells,in vitro,wildtype,human,Stromal
GSE156184,Senescent1_vs_Control1,4.38,1.252,p=0.00116,Normal human prostate derived primary stromal cells,in vitro,wildtype,human,Stromal
GSE156472,Senescent1_vs_Control1,4.38,1.252,p=0.00116,primary human prostate stromal cells,in vitro,wildtype,human,Stromal
GSE160702,Senescent1_vs_Control1,0.076,0.498,N.S.,human endometrial stromal cells,in vitro,wildtype,human,Stromal
GSE165406,Senescent1_vs_Control1,0.765,1.133,N.S.,human umbilical vein endothelial cells,in vitro,c1 wildtype; s1 genetically edited (siRNA knockdown of CCM2),human,Endothelial
GSE166035,Senescent2_vs_Control2,2.589,3.744,N.S.,primary small airway epithelial cells,in vitro,wildtype,human,Epithelial
GSE168994,Senescent1_vs_Control1,1.074,1.884,N.S.,human lung fibroblast,in vitro,wildtype,human,Fibroblasts
GSE176199,Senescent1_vs_Control1,-4.545,0.716,p<0.00001,human cartilage mesenchymal stromal cells,in vitro,wildtype,human,Chondrocytes
GSE176324,Senescent1_vs_Control1,-0.982,0.371,N.S.,primary human pancreatic islets,in vitro,wildtype,human,Pancreatic
GSE180361,Senescent2_vs_Control2,-1.793,1.694,N.S.,human keratinocytes,in vitro,s2 HRAS G12V overexpression; c2 wildtype,human,Epithelial
GSE180406,Senescent1_vs_Control1,-0.566,1.348,N.S.,human MRC-5 cell line,in vitro,wildtype,human,Other
GSE184892,Senescent1_vs_Control1,0.413,0.791,N.S.,human primary fibroblast,in vitro,wildtype,human,Fibroblasts
GSE198396,Senescent1_vs_Control1,2.387,1.349,N.S.,human foreskin fibroblast cell line HCA2,in vitro,wildtype,human,Fibroblasts
GSE207816,Senescent1_vs_Control1,-1.097,0.678,N.S.,human pancreatic beta cells,in vitro,wildtype,human,Pancreatic
GSE214409,Senescent1_vs_Control1,1.944,1.27,N.S.,primary human IMR90 fibroblasts,in vitro,c1 wildtype; s1 HRasV12 overexpression,human,Fibroblasts
GSE221104,Senescent1_vs_Control1,1.278,1.244,N.S.,human WI-38 fibroblast cell line,in vitro,wildtype,human,Fibroblasts
GSE222400,Senescent1_vs_Control1,3.185,1.915,N.S.,human lung fibroblast cells,in vitro,wildtype,human,Fibroblasts
GSE234417,Senescent1_vs_Control1,2.615,0.419,p<0.00001,WI-38 cells,in vitro,wildtype,human,Fibroblasts
GSE235768,Senescent1_vs_Control1,-0.118,0.924,N.S.,human normal skin fibroblasts,in vitro,wildtype,human,Fibroblasts
GSE235768,Senescent2_vs_Control2,0.535,0.816,N.S.,human normal skin fibroblasts,in vitro,wildtype,human,Fibroblasts
GSE235768,Senescent3_vs_Control3,-2.907,0.795,p=0.00200,human normal lung fibroblasts,in vitro,wildtype,human,Fibroblasts
GSE235768,Senescent4_vs_Control4,-1.794,0.707,N.S.,human normal lung fibroblasts,in vitro,wildtype,human,Fibroblasts
GSE238252,Senescent1_vs_Control1,-0.76,2.544,N.S.,human lung fibroblast,in vitro,wildtype,human,Fibroblasts
GSE238254,Senescent1_vs_Control1,-1.412,0.587,N.S.,human lung fibroblast,in vitro,wildtype,human,Fibroblasts
GSE245045,Senescent1_vs_Control1,0.678,0.927,N.S.,primary dermal fibroblast,in vitro,wildtype,human,Fibroblasts
GSE245147,Senescent1_vs_Control1,2.699,0.063,p<0.00001,human nucleus pulposus cells,in vitro,wildtype,human,Musculoskeletal
GSE246073,Senescent1_vs_Control1,2.301,0.593,p=0.00843,human astrocytes derived from hESC,in vitro,wildtype,human,Neural
GSE250224,Senescent1_vs_Control1,0.66,0.052,p<0.00001,human corneal endothelial cell,in vitro,wildtype,human,Endothelial
GSE250224,Senescent2_vs_Control1,0.583,0.052,p<0.00001,human corneal endothelial cell,in vitro,wildtype,human,Endothelial
GSE251814,Senescent1_vs_Control1,-1.3,0.831,N.S.,human induced pluripotent stem cells,in vitro,genetically edited (inducible CRISPRi targeting TERF2),human,Other
GSE264316,Senescent1_vs_Control1,5.254,1.34,p=0.00023,human primary prostate stromal cell line,in vitro,wildtype,human,Stromal
GSE268487,Senescent1_vs_Control1,2.233,1.161,N.S.,human lung fibroblasts,in vitro,wildtype,human,Fibroblasts
GSE274295,Senescent1_vs_Control1,-1.705,2.369,N.S.,Human embryonic lung fibroblasts,in vitro,wildtype,human,Fibroblasts
GSE280365,Senescent1_vs_Control1,1.768,0.835,N.S.,lung fibroblasts,in vitro,WT,human,Fibroblasts
GSE287646,Senescent1_vs_Control1,4.034,0.908,p=0.00007,human ASC52telo mesenchymal stem cells,in vitro,wildtype,human,Stromal
GSE294733,Senescent1_vs_Control1,1.363,1.544,N.S.,human umbilical vein endothelial cells,in vitro,wildtype,human,Endothelial
GSE294733,Senescent2_vs_Control1,1.082,1.555,N.S.,human umbilical vein endothelial cells,in vitro,wildtype,human,Endothelial
GSE59966,Senescent1_vs_Control1,-4.795,1.345,p=0.00476,human mesenchymal stromal cells,in vitro,wildtype,human,Stromal
GSE60340,Senescent2_vs_Control1,-4.325,1.782,p=0.02826,MDAH041 LFS fibroblasts,in vitro,wildtype,human,Fibroblasts
GSE61130,Senescent1_vs_Control1,-4.988,0.648,p<0.00001,human IMR90 fibroblasts,in vitro,wildtype,human,Fibroblasts
GSE63577,Senescent3_vs_Control3,3.974,1.796,N.S.,human HFF fibroblasts,in vitro,wildtype,human,Fibroblasts
GSE94395,Senescent1_vs_Control1,2.167,0.853,p=0.02787,human fibroblasts (IMR90 cell line),in vitro,wildtype,human,Fibroblasts
GSE99028,Senescent1_vs_Control1,-0.338,1.218,N.S.,primary human fibroblasts,in vitro,wildtype,human,Fibroblasts
GSE133292,Senescent1_vs_Control1,0.327,0.909,N.S.,human foreskin fibroblasts,in vitro,wildtype,human,Fibroblasts
GSE155371,Senescent1_vs_Control1,-0.422,0.81,N.S.,primary human oral keratinocytes,in vitro,wildtype,human,Epithelial
GSE165532,Senescent2_vs_Control2,-1.879,0.987,N.S.,human WI-38 fibroblast cell line,in vitro,wildtype,human,Fibroblasts
GSE230181,Senescent1_vs_Control1,0.397,0.64,N.S.,s1 IMR90 cell line; s1 ADSC; c1 ADSC; s1 RPTEC; c1 RPTEC; s1 HUVEC; c1 HUVEC; s1 HMVEC; c1 HMVEC,in vitro,wildtype,human,Fibroblasts
GSE230181,Senescent8_vs_Control1,5.742,0.868,p<0.00001,IMR90 cell line,in vitro,wildtype,human,Fibroblasts
GSE230181,Senescent2_vs_Control1,2.166,0.79,p=0.01436,IMR90 cell line,in vitro,wildtype,human,Fibroblasts
GSE230181,Senescent3_vs_Control1,3.857,0.756,p<0.00001,IMR90 cell line,in vitro,wildtype,human,Fibroblasts
GSE230181,Senescent4_vs_Control1,2.473,0.787,p=0.00549,IMR90 cell line,in vitro,wildtype,human,Fibroblasts
GSE230181,Senescent6_vs_Control1,6.192,0.867,p<0.00001,IMR90 cell line,in vitro,wildtype,human,Fibroblasts
GSE230181,Senescent7_vs_Control1,5.587,0.747,p<0.00001,IMR90 cell line,in vitro,wildtype,human,Fibroblasts
GSE230181,Senescent5_vs_Control1,5.441,0.747,p<0.00001,IMR90 cell line,in vitro,wildtype,human,Fibroblasts
GSE230181,Senescent9_vs_Control1,5.225,0.795,p<0.00001,IMR90 cell line,in vitro,wildtype,human,Fibroblasts
GSE230358,Senescent1_vs_Control1,-0.692,0.535,N.S.,human IMR90 fibroblast cell line,in vitro,wildtype,human,Fibroblasts
GSE230358,Senescent8_vs_Control1,1.26,1.049,N.S.,human IMR90 fibroblast cell line,in vitro,wildtype,human,Fibroblasts
GSE230358,Senescent2_vs_Control1,-1.558,1.096,N.S.,human IMR90 fibroblast cell line,in vitro,wildtype,human,Fibroblasts
GSE230358,Senescent3_vs_Control1,-1.831,1.113,N.S.,human IMR90 fibroblast cell line,in vitro,wildtype,human,Fibroblasts
GSE230358,Senescent4_vs_Control1,0.3,0.851,N.S.,human IMR90 fibroblast cell line,in vitro,wildtype,human,Fibroblasts
GSE230358,Senescent6_vs_Control1,-2.924,1.253,N.S.,human IMR90 fibroblast cell line,in vitro,wildtype,human,Fibroblasts
GSE230358,Senescent7_vs_Control1,2.426,0.845,p=0.02187,human IMR90 fibroblast cell line,in vitro,wildtype,human,Fibroblasts
GSE230358,Senescent5_vs_Control1,-2.434,1.119,N.S.,human IMR90 fibroblast cell line,in vitro,wildtype,human,Fibroblasts
GSE230358,Senescent9_vs_Control1,2.32,0.845,p=0.02868,human IMR90 fibroblast cell line,in vitro,wildtype,human,Fibroblasts
GSE296209,Senescent1_vs_Control1,0.253,1.099,N.S.,human primary prostate stromal cells,in vitro,wildtype,human,Stromal
GSE76605,Senescent1_vs_Control1,0.552,1.737,N.S.,unknown,in vitro,c1 wildtype; s1 genetically edited (BRAF overexpression),human,Other
GSE216842,Senescent1_vs_Control1,4.6,1.534,p=0.00643,human primary stromal cell line,in vitro,wildtype,human,Stromal
GSE216842,Senescent2_vs_Control2,3.391,1.627,N.S.,human primary stromal cell line,in vitro,wildtype,human,Stromal
GSE216842,Senescent4_vs_Control4,1.343,1.247,N.S.,human primary stromal cell line,in vitro,wildtype,human,Stromal
GSE252675,Senescent1_vs_Control1,0.389,1.242,N.S.,human nucleus pulposus mesenchymal stem cells,in vitro,wildtype,human,Musculoskeletal
GSE280050,Senescent1_vs_Control1,-2.497,0.37,p<0.00001,human cardiac organoids,in vitro,wildtype,human,Other
