study,comparison,log2fc,lfcSE,padj,sample_type,origin,genotype,organism,simple_label
GSE53356,Senescent1_vs_Control1,1.606,1.023,N.S.,human IMR90 cell line,in vitro,wildtype,human,Fibroblasts
GSE117979,Senescent1_vs_Control1,2.164,0.901,p=0.03815,mouse embryonic fibroblasts,in vitro,wildtype C57BL/6,mouse,Fibroblasts
GSE117979,Senescent2_vs_Control2,-2.495,1.389,N.S.,c2 mouse embryonic fibroblasts; c2 mouse embryonic fibroblata; s2 mouse embryonic fibroblasts,in vitro,wildtype C57BL/6,mouse,Fibroblasts
GSE117979,Senescent3_vs_Control3,2.596,0.921,p=0.00871,mouse embryonic fibroblasts,in vitro,wildtype C57BL/6,mouse,Fibroblasts
GSE169489,Senescent2_vs_Control1,5.592,3.877,N.S.,MEF14_Dox+_Day8,in vitro,wildtype,mouse,Fibroblasts
GSE202032,Senescent1_vs_Control1,0.519,0.365,N.S.,mouse embryonic fibroblasts,in vitro,wildtype,mouse,Fibroblasts
GSE210362,Senescent1_vs_Control1,-3.874,1.385,p=0.01791,murine embryonic fibroblasts,in vitro,c1 wildtype; s1 genetically edited (Myc knockout),mouse,Fibroblasts
GSE218683,Senescent1_vs_Control1,-0.163,1.289,N.S.,mouse embryonic fibroblasts,in vitro,wildtype,mouse,Fibroblasts
GSE218683,Senescent2_vs_Control2,-1.323,1.53,N.S.,mouse embryonic fibroblasts,in vitro,wildtype,mouse,Fibroblasts
GSE219126,Senescent1_vs_Control1,-0.491,0.12,p=0.00074,mouse intestinal organoids,in vitro,wildtype C57BL/6,mouse,Other
GSE229010,Senescent1_vs_Control1,1.983,1.182,N.S.,primary mouse adult fibroblast,in vitro,wildtype,mouse,Fibroblasts
GSE233718,Senescent1_vs_Control1,2.325,1.066,N.S.,mouse proximal tubular epithelial cells,in vitro,wildtype C57BL/6Rj,mouse,Epithelial
GSE247975,Senescent1_vs_Control1,-1.599,3.203,N.S.,mouse fibro-adipogenic progenitors,in vitro,wildtype C57BL/6,mouse,Stromal
GSE281894,Senescent1_vs_Control1,2.793,2.931,N.S.,podocytes,in vitro,wildtype,mouse,Renal
GSE179880,Senescent1_vs_Control1,-2.309,1.189,N.S.,mouse skin fibroblasts,in vitro,wildtype,mouse,Fibroblasts
GSE105937,Senescent2_vs_Control1,3.823,2.769,N.S.,human IMR90 lung fibroblasts,in vitro,wildtype,human,Fibroblasts
GSE109700,Senescent1_vs_Control1,2.027,2.421,N.S.,human lung fibroblast cells,in vitro,wildtype,human,Fibroblasts
GSE128420,Senescent1_vs_Control1,-1.811,0.767,p=0.03140,primary normal human prostate stromal cells,in vitro,wildtype,human,Stromal
GSE132204,Senescent1_vs_Control1,-3.543,1.282,p=0.02564,primary human corneal endothelial cells,in vitro,wildtype,human,Endothelial
GSE132204,Senescent2_vs_Control2,-3.925,1.279,p=0.01175,primary human corneal endothelial cells,in vitro,wildtype,human,Endothelial
GSE155680,Senescent1_vs_Control1,1.711,1.256,N.S.,primary human umbilical vein endothelial cells,in vitro,wildtype,human,Endothelial
GSE156038,Senescent1_vs_Control1,3.587,1.42,p=0.02195,human prostate primary stromal cells,in vitro,wildtype,human,Stromal
GSE156184,Senescent1_vs_Control1,3.587,1.42,p=0.02145,Normal human prostate derived primary stromal cells,in vitro,wildtype,human,Stromal
GSE156472,Senescent1_vs_Control1,3.587,1.42,p=0.02144,primary human prostate stromal cells,in vitro,wildtype,human,Stromal
GSE165406,Senescent1_vs_Control1,3.416,0.553,p<0.00001,human umbilical vein endothelial cells,in vitro,c1 wildtype; s1 genetically edited (siRNA knockdown of CCM2),human,Endothelial
GSE166035,Senescent1_vs_Control1,-1.289,0.326,p=0.00046,primary small airway epithelial cells,in vitro,wildtype,human,Epithelial
GSE166035,Senescent2_vs_Control2,-0.657,0.279,p=0.03234,primary small airway epithelial cells,in vitro,wildtype,human,Epithelial
GSE166059,Senescent1_vs_Control1,-1.287,0.121,p<0.00001,human SAEC cells,in vitro,wildtype,human,Other
GSE166059,Senescent2_vs_Control2,-0.2,0.108,N.S.,human SAEC cells,in vitro,wildtype,human,Other
GSE176199,Senescent1_vs_Control1,-3.062,1.943,N.S.,human cartilage mesenchymal stromal cells,in vitro,wildtype,human,Chondrocytes
GSE176324,Senescent1_vs_Control1,0.139,0.798,N.S.,primary human pancreatic islets,in vitro,wildtype,human,Pancreatic
GSE180361,Senescent1_vs_Control1,-0.845,1.565,N.S.,human IMR90 fibroblasts,in vitro,s1 p16 overexpression; c1 wildtype,human,Fibroblasts
GSE180361,Senescent2_vs_Control2,-0.407,0.109,p=0.00055,human keratinocytes,in vitro,s2 HRAS G12V overexpression; c2 wildtype,human,Epithelial
GSE214409,Senescent1_vs_Control1,3.895,2.612,N.S.,primary human IMR90 fibroblasts,in vitro,c1 wildtype; s1 HRasV12 overexpression,human,Fibroblasts
GSE221104,Senescent1_vs_Control1,1.328,2.45,N.S.,human WI-38 fibroblast cell line,in vitro,wildtype,human,Fibroblasts
GSE245147,Senescent1_vs_Control1,-1.518,0.853,N.S.,human nucleus pulposus cells,in vitro,wildtype,human,Musculoskeletal
GSE250224,Senescent1_vs_Control1,0.077,1.315,N.S.,human corneal endothelial cell,in vitro,wildtype,human,Endothelial
GSE250224,Senescent2_vs_Control1,0.539,1.269,N.S.,human corneal endothelial cell,in vitro,wildtype,human,Endothelial
GSE251814,Senescent1_vs_Control1,-0.566,0.501,N.S.,human induced pluripotent stem cells,in vitro,genetically edited (inducible CRISPRi targeting TERF2),human,Other
GSE264316,Senescent1_vs_Control1,2.712,2.094,N.S.,human primary prostate stromal cell line,in vitro,wildtype,human,Stromal
GSE268487,Senescent1_vs_Control1,1.743,1.714,N.S.,human lung fibroblasts,in vitro,wildtype,human,Fibroblasts
GSE275256,Senescent1_vs_Control1,1.578,0.688,N.S.,human immortalized microglia cell line,in vitro,wildtype,human,Neural
GSE280365,Senescent1_vs_Control1,-2.603,1.735,N.S.,lung fibroblasts,in vitro,WT,human,Fibroblasts
GSE287646,Senescent1_vs_Control1,-1.143,0.657,N.S.,human ASC52telo mesenchymal stem cells,in vitro,wildtype,human,Stromal
GSE60340,Senescent2_vs_Control1,3.149,0.891,p=0.00103,MDAH041 LFS fibroblasts,in vitro,wildtype,human,Fibroblasts
GSE61130,Senescent1_vs_Control1,-0.195,2.55,N.S.,human IMR90 fibroblasts,in vitro,wildtype,human,Fibroblasts
GSE63577,Senescent3_vs_Control3,2.188,2.23,N.S.,human HFF fibroblasts,in vitro,wildtype,human,Fibroblasts
GSE155371,Senescent1_vs_Control1,-0.304,0.2,N.S.,primary human oral keratinocytes,in vitro,wildtype,human,Epithelial
GSE165532,Senescent2_vs_Control2,2.703,3.188,N.S.,human WI-38 fibroblast cell line,in vitro,wildtype,human,Fibroblasts
GSE230181,Senescent1_vs_Control1,-2.701,0.692,p=0.00061,s1 IMR90 cell line; s1 ADSC; c1 ADSC; s1 RPTEC; c1 RPTEC; s1 HUVEC; c1 HUVEC; s1 HMVEC; c1 HMVEC,in vitro,wildtype,human,Fibroblasts
GSE230181,Senescent8_vs_Control1,-7.078,1.639,p=0.00012,IMR90 cell line,in vitro,wildtype,human,Fibroblasts
GSE230181,Senescent2_vs_Control1,-5.588,1.188,p=0.00001,IMR90 cell line,in vitro,wildtype,human,Fibroblasts
GSE230181,Senescent3_vs_Control1,-4.668,1.062,p=0.00006,IMR90 cell line,in vitro,wildtype,human,Fibroblasts
GSE230181,Senescent4_vs_Control1,-4.684,1.089,p=0.00010,IMR90 cell line,in vitro,wildtype,human,Fibroblasts
GSE230181,Senescent6_vs_Control1,-5.332,1.413,p=0.00090,IMR90 cell line,in vitro,wildtype,human,Fibroblasts
GSE230181,Senescent7_vs_Control1,-5.734,1.182,p=0.00001,IMR90 cell line,in vitro,wildtype,human,Fibroblasts
GSE230181,Senescent5_vs_Control1,-5.077,1.109,p=0.00003,IMR90 cell line,in vitro,wildtype,human,Fibroblasts
GSE230181,Senescent9_vs_Control1,-6.619,1.417,p=0.00002,IMR90 cell line,in vitro,wildtype,human,Fibroblasts
GSE230358,Senescent1_vs_Control1,-2.279,0.699,p=0.00723,human IMR90 fibroblast cell line,in vitro,wildtype,human,Fibroblasts
GSE230358,Senescent8_vs_Control1,-4.428,1.592,p=0.03254,human IMR90 fibroblast cell line,in vitro,wildtype,human,Fibroblasts
GSE230358,Senescent2_vs_Control1,-5.061,1.697,p=0.01145,human IMR90 fibroblast cell line,in vitro,wildtype,human,Fibroblasts
GSE230358,Senescent3_vs_Control1,-5.042,1.719,p=0.01095,human IMR90 fibroblast cell line,in vitro,wildtype,human,Fibroblasts
GSE230358,Senescent4_vs_Control1,-3.814,1.184,p=0.00655,human IMR90 fibroblast cell line,in vitro,wildtype,human,Fibroblasts
GSE230358,Senescent6_vs_Control1,-2.594,1.471,N.S.,human IMR90 fibroblast cell line,in vitro,wildtype,human,Fibroblasts
GSE230358,Senescent7_vs_Control1,-5.42,1.375,p=0.00104,human IMR90 fibroblast cell line,in vitro,wildtype,human,Fibroblasts
GSE230358,Senescent5_vs_Control1,-4.721,1.575,p=0.01669,human IMR90 fibroblast cell line,in vitro,wildtype,human,Fibroblasts
GSE230358,Senescent9_vs_Control1,-5.54,1.372,p=0.00075,human IMR90 fibroblast cell line,in vitro,wildtype,human,Fibroblasts
GSE295083,Senescent1_vs_Control1,2.739,2.26,N.S.,human primary fibroblasts,in vitro,wildtype,human,Fibroblasts
GSE296209,Senescent1_vs_Control1,-1.252,0.71,N.S.,human primary prostate stromal cells,in vitro,wildtype,human,Stromal
GSE216842,Senescent1_vs_Control1,2.893,1.749,N.S.,human primary stromal cell line,in vitro,wildtype,human,Stromal
GSE216842,Senescent2_vs_Control2,4.317,1.702,p=0.02266,human primary stromal cell line,in vitro,wildtype,human,Stromal
GSE216842,Senescent4_vs_Control4,1.825,1.664,N.S.,human primary stromal cell line,in vitro,wildtype,human,Stromal
GSE280050,Senescent1_vs_Control1,-1.584,0.329,p=0.00001,human cardiac organoids,in vitro,wildtype,human,Other
