study,comparison,log2fc,lfcSE,padj,sample_type,origin,genotype,organism,simple_label
GSE130099,Senescent1_vs_Control1,0.261,1.131,N.S.,human BJ-TERT fibroblasts,in vitro,c1 genetically edited (TERT overexpression); s1 genetically edited (TERT overexpression; myrAKT1 overexpression),human,Fibroblasts
GSE212085,Senescent1_vs_Control1,2.264,0.189,p<0.00001,human foetal lung fibroblast cell line IMR-90,in vitro,wildtype,human,Fibroblasts
GSE224071,Senescent1_vs_Control1,-0.432,0.364,N.S.,human lung fibroblast cell line,in vitro,wildtype,human,Fibroblasts
GSE53356,Senescent1_vs_Control1,-0.602,0.397,N.S.,human IMR90 cell line,in vitro,wildtype,human,Fibroblasts
GSE117208,Senescent1_vs_Control1,0.311,0.551,N.S.,mouse embryonic fibroblasts (MEFs),in vitro,wildtype C57BL/6,mouse,Fibroblasts
GSE117979,Senescent1_vs_Control1,0.324,0.153,N.S.,mouse embryonic fibroblasts,in vitro,wildtype C57BL/6,mouse,Fibroblasts
GSE117979,Senescent2_vs_Control2,-0.954,0.154,p<0.00001,c2 mouse embryonic fibroblasts; c2 mouse embryonic fibroblata; s2 mouse embryonic fibroblasts,in vitro,wildtype C57BL/6,mouse,Fibroblasts
GSE117979,Senescent3_vs_Control3,0.518,0.152,p=0.00138,mouse embryonic fibroblasts,in vitro,wildtype C57BL/6,mouse,Fibroblasts
GSE139575,Senescent1_vs_Control1,0.413,0.15,p=0.01875,mouse embryonic fibroblasts (MEF),in vitro,c1 wildtype C57BL/6; s1 genetically edited (overexpression of p21),mouse,Fibroblasts
GSE139575,Senescent2_vs_Control1,-0.046,0.151,N.S.,mouse embryonic fibroblasts (MEF),in vitro,genetically edited (overexpression of p16),mouse,Fibroblasts
GSE169489,Senescent2_vs_Control1,-1.081,0.251,p=0.00013,MEF14_Dox+_Day8,in vitro,wildtype,mouse,Fibroblasts
GSE176107,Senescent1_vs_Control1,1.409,0.112,p<0.00001,mouse tail fibroblast,in vitro,wildtype C57BL/6,mouse,Fibroblasts
GSE182731,Senescent2_vs_Control2,0.795,0.095,p<0.00001,primary mouse lung fibroblasts,in vitro,wildtype C57BL/6,mouse,Fibroblasts
GSE182731,Senescent3_vs_Control3,-0.098,0.112,N.S.,primary mouse lung fibroblasts,in vitro,wildtype C57BL/6,mouse,Fibroblasts
GSE202032,Senescent1_vs_Control1,0.722,0.238,p=0.00858,mouse embryonic fibroblasts,in vitro,wildtype,mouse,Fibroblasts
GSE210362,Senescent1_vs_Control1,0.172,0.088,N.S.,murine embryonic fibroblasts,in vitro,c1 wildtype; s1 genetically edited (Myc knockout),mouse,Fibroblasts
GSE218683,Senescent1_vs_Control1,-0.796,0.242,p=0.01013,mouse embryonic fibroblasts,in vitro,wildtype,mouse,Fibroblasts
GSE218683,Senescent2_vs_Control2,0.013,0.243,N.S.,mouse embryonic fibroblasts,in vitro,wildtype,mouse,Fibroblasts
GSE218684,Senescent1_vs_Control1,1.318,0.276,p=0.00005,mouse embryonic fibroblast,in vitro,wildtype,mouse,Fibroblasts
GSE218684,Senescent2_vs_Control2,0.582,0.275,N.S.,mouse embryonic fibroblast,in vitro,wildtype,mouse,Fibroblasts
GSE219126,Senescent1_vs_Control1,-0.394,0.102,p=0.00156,mouse intestinal organoids,in vitro,wildtype C57BL/6,mouse,Other
GSE229010,Senescent1_vs_Control1,0.724,0.094,p<0.00001,primary mouse adult fibroblast,in vitro,wildtype,mouse,Fibroblasts
GSE233718,Senescent1_vs_Control1,-1.145,0.218,p<0.00001,mouse proximal tubular epithelial cells,in vitro,wildtype C57BL/6Rj,mouse,Epithelial
GSE247975,Senescent1_vs_Control1,0.508,0.195,p=0.02674,mouse fibro-adipogenic progenitors,in vitro,wildtype C57BL/6,mouse,Stromal
GSE278372,Senescent1_vs_Control1,0.758,0.38,N.S.,primary mouse embryonic fibroblasts,in vitro,wildtype,mouse,Fibroblasts
GSE278372,Senescent2_vs_Control2,0.992,0.328,p=0.02694,primary mouse embryonic fibroblasts,in vitro,wildtype,mouse,Fibroblasts
GSE279349,Senescent1_vs_Control1,0.851,0.202,p=0.00036,primary mouse embryonic fibroblasts,in vitro,wildtype,mouse,Fibroblasts
GSE279349,Senescent2_vs_Control1,1.022,0.202,p=0.00001,primary mouse embryonic fibroblasts,in vitro,wildtype,mouse,Fibroblasts
GSE281894,Senescent1_vs_Control1,-0.092,0.168,N.S.,podocytes,in vitro,wildtype,mouse,Renal
GSE160279,mouse_Senescent2_vs_Control2,0.596,0.411,N.S.,mouse embryonic fibroblasts,in vitro,wildtype,mouse,Fibroblasts
GSE179880,Senescent1_vs_Control1,0.155,0.124,N.S.,mouse skin fibroblasts,in vitro,wildtype,mouse,Fibroblasts
GSE201217,Senescent1_vs_Control1,-0.035,0.762,N.S.,primary PWK mouse cells,in vitro,wildtype,mouse,Other
GSE247607,human_Senescent1_vs_Control1,-0.805,0.595,N.S.,human IMR-90 fibroblast cell line,in vitro,wildtype,human,Fibroblasts
GSE101750,Senescent1_vs_Control1,-0.594,0.377,N.S.,human IMR90 fibroblasts,in vitro,wildtype,human,Fibroblasts
GSE103938,Senescent2_vs_Control1,-2.674,0.785,p=0.00400,human IMR90 fibroblasts,in vitro,wildtype,human,Fibroblasts
GSE105937,Senescent1_vs_Control1,-1.183,0.47,N.S.,human IMR90 lung fibroblasts,in vitro,wildtype,human,Fibroblasts
GSE105937,Senescent2_vs_Control1,0.277,0.415,N.S.,human IMR90 lung fibroblasts,in vitro,wildtype,human,Fibroblasts
GSE108278,Senescent1_vs_Control1,-1.043,1.066,N.S.,IMR90 hTERT lung fibroblast,in vitro,wildtype,human,Fibroblasts
GSE109700,Senescent1_vs_Control1,1.024,0.59,N.S.,human lung fibroblast cells,in vitro,wildtype,human,Fibroblasts
GSE118583,Senescent1_vs_Control1,1.619,0.761,N.S.,human lung fibroblast cell line IMR-90,in vitro,wildtype,human,Fibroblasts
GSE124609,Senescent1_vs_Control1,0.893,0.492,N.S.,human lung fibroblasts,in vitro,wildtype,human,Fibroblasts
GSE125632,Senescent1_vs_Control1,-0.033,0.684,N.S.,human bone marrow mesenchymal stromal cells,in vitro,wildtype,human,Stromal
GSE128420,Senescent1_vs_Control1,-0.671,0.13,p<0.00001,primary normal human prostate stromal cells,in vitro,wildtype,human,Stromal
GSE130306,Senescent1_vs_Control1,0.734,0.176,p=0.00011,human WI-38 fibroblasts,in vitro,wildtype,human,Fibroblasts
GSE132204,Senescent1_vs_Control1,0.721,0.412,N.S.,primary human corneal endothelial cells,in vitro,wildtype,human,Endothelial
GSE132204,Senescent2_vs_Control2,0.749,0.408,N.S.,primary human corneal endothelial cells,in vitro,wildtype,human,Endothelial
GSE132370,Senescent1_vs_Control1,2.18,0.502,p=0.00007,human IMR90 fibroblasts,in vitro,wildtype,human,Fibroblasts
GSE144752,Senescent1_vs_Control1,-0.306,1.541,N.S.,BJ hTERT fibroblast,in vitro,wildtype,human,Fibroblasts
GSE153921,Senescent1_vs_Control1,-1.733,0.345,p<0.00001,human IMR90 ER:RAS cell line,in vitro,genetically edited (shRNA knockdown of XPO7),human,Fibroblasts
GSE155680,Senescent1_vs_Control1,-0.26,0.103,p=0.02576,primary human umbilical vein endothelial cells,in vitro,wildtype,human,Endothelial
GSE155903,Senescent1_vs_Control1,-0.527,0.365,N.S.,IMR90 ER:RAS cell line,in vitro,genetically edited (ER:RAS),human,Fibroblasts
GSE156038,Senescent1_vs_Control1,0.541,0.093,p<0.00001,human prostate primary stromal cells,in vitro,wildtype,human,Stromal
GSE156184,Senescent1_vs_Control1,0.54,0.093,p<0.00001,Normal human prostate derived primary stromal cells,in vitro,wildtype,human,Stromal
GSE156472,Senescent1_vs_Control1,0.54,0.093,p<0.00001,primary human prostate stromal cells,in vitro,wildtype,human,Stromal
GSE157867,Senescent1_vs_Control1,-1.02,0.723,N.S.,human umbilical vein endothelial cell,in vitro,wildtype,human,Endothelial
GSE160273,Senescent1_vs_Control1,-1.517,0.992,N.S.,human bone mesenchymal stem cells,in vitro,wildtype,human,Stromal
GSE160702,Senescent1_vs_Control1,-1.071,0.368,p=0.02227,human endometrial stromal cells,in vitro,wildtype,human,Stromal
GSE165406,Senescent1_vs_Control1,-1.18,0.125,p<0.00001,human umbilical vein endothelial cells,in vitro,c1 wildtype; s1 genetically edited (siRNA knockdown of CCM2),human,Endothelial
GSE166035,Senescent1_vs_Control1,0.054,0.076,N.S.,primary small airway epithelial cells,in vitro,wildtype,human,Epithelial
GSE166035,Senescent2_vs_Control2,0.586,0.065,p<0.00001,primary small airway epithelial cells,in vitro,wildtype,human,Epithelial
GSE166059,Senescent1_vs_Control1,0.053,0.051,N.S.,human SAEC cells,in vitro,wildtype,human,Other
GSE166059,Senescent2_vs_Control2,0.522,0.049,p<0.00001,human SAEC cells,in vitro,wildtype,human,Other
GSE168994,Senescent1_vs_Control1,0.993,1.469,N.S.,human lung fibroblast,in vitro,wildtype,human,Fibroblasts
GSE171780,Senescent1_vs_Control1,-1.999,0.349,p<0.00001,human fibroblast cell line IMR90,in vitro,wildtype,human,Fibroblasts
GSE176199,Senescent1_vs_Control1,1.878,0.167,p<0.00001,human cartilage mesenchymal stromal cells,in vitro,wildtype,human,Chondrocytes
GSE176324,Senescent1_vs_Control1,-0.189,0.185,N.S.,primary human pancreatic islets,in vitro,wildtype,human,Pancreatic
GSE180361,Senescent1_vs_Control1,1.05,0.795,N.S.,human IMR90 fibroblasts,in vitro,s1 p16 overexpression; c1 wildtype,human,Fibroblasts
GSE180361,Senescent2_vs_Control2,0.531,0.065,p<0.00001,human keratinocytes,in vitro,s2 HRAS G12V overexpression; c2 wildtype,human,Epithelial
GSE180406,Senescent1_vs_Control1,0.065,0.324,N.S.,human MRC-5 cell line,in vitro,wildtype,human,Other
GSE184892,Senescent1_vs_Control1,0.301,0.907,N.S.,human primary fibroblast,in vitro,wildtype,human,Fibroblasts
GSE198396,Senescent1_vs_Control1,1.192,0.245,p=0.00001,human foreskin fibroblast cell line HCA2,in vitro,wildtype,human,Fibroblasts
GSE207816,Senescent1_vs_Control1,-0.11,0.373,N.S.,human pancreatic beta cells,in vitro,wildtype,human,Pancreatic
GSE214409,Senescent1_vs_Control1,-0.468,0.587,N.S.,primary human IMR90 fibroblasts,in vitro,c1 wildtype; s1 HRasV12 overexpression,human,Fibroblasts
GSE221104,Senescent1_vs_Control1,1.569,0.12,p<0.00001,human WI-38 fibroblast cell line,in vitro,wildtype,human,Fibroblasts
GSE222400,Senescent1_vs_Control1,2.712,0.49,p<0.00001,human lung fibroblast cells,in vitro,wildtype,human,Fibroblasts
GSE222400,Senescent2_vs_Control2,1.773,0.444,p=0.00206,human lung fibroblast cells,in vitro,wildtype,human,Fibroblasts
GSE226005,Senescent1_vs_Control1,-1.629,1.053,N.S.,fibroblast cell line,in vitro,wildtype,human,Fibroblasts
GSE234417,Senescent1_vs_Control1,1.743,0.117,p<0.00001,WI-38 cells,in vitro,wildtype,human,Fibroblasts
GSE235768,Senescent1_vs_Control1,1.032,0.656,N.S.,human normal skin fibroblasts,in vitro,wildtype,human,Fibroblasts
GSE235768,Senescent2_vs_Control2,0.971,0.556,N.S.,human normal skin fibroblasts,in vitro,wildtype,human,Fibroblasts
GSE235768,Senescent3_vs_Control3,0.694,0.541,N.S.,human normal lung fibroblasts,in vitro,wildtype,human,Fibroblasts
GSE235768,Senescent4_vs_Control4,0.077,0.553,N.S.,human normal lung fibroblasts,in vitro,wildtype,human,Fibroblasts
GSE238252,Senescent1_vs_Control1,3.175,1.062,p=0.03665,human lung fibroblast,in vitro,wildtype,human,Fibroblasts
GSE238254,Senescent1_vs_Control1,1.468,0.2,p<0.00001,human lung fibroblast,in vitro,wildtype,human,Fibroblasts
GSE245045,Senescent1_vs_Control1,0.961,0.512,N.S.,primary dermal fibroblast,in vitro,wildtype,human,Fibroblasts
GSE245147,Senescent1_vs_Control1,0.71,0.108,p<0.00001,human nucleus pulposus cells,in vitro,wildtype,human,Musculoskeletal
GSE246073,Senescent1_vs_Control1,0.715,0.585,N.S.,human astrocytes derived from hESC,in vitro,wildtype,human,Neural
GSE250224,Senescent1_vs_Control1,0.709,0.43,N.S.,human corneal endothelial cell,in vitro,wildtype,human,Endothelial
GSE250224,Senescent2_vs_Control1,0.558,0.434,N.S.,human corneal endothelial cell,in vitro,wildtype,human,Endothelial
GSE251814,Senescent1_vs_Control1,-0.848,0.327,N.S.,human induced pluripotent stem cells,in vitro,genetically edited (inducible CRISPRi targeting TERF2),human,Other
GSE264316,Senescent1_vs_Control1,1.343,0.115,p<0.00001,human primary prostate stromal cell line,in vitro,wildtype,human,Stromal
GSE268487,Senescent1_vs_Control1,-0.876,0.501,N.S.,human lung fibroblasts,in vitro,wildtype,human,Fibroblasts
GSE269856,Senescent1_vs_Control1,-0.25,0.61,N.S.,human primary lung fibroblasts,in vitro,wildtype,human,Fibroblasts
GSE274295,Senescent1_vs_Control1,-0.45,0.849,N.S.,Human embryonic lung fibroblasts,in vitro,wildtype,human,Fibroblasts
GSE275256,Senescent1_vs_Control1,-0.288,0.52,N.S.,human immortalized microglia cell line,in vitro,wildtype,human,Neural
GSE280365,Senescent1_vs_Control1,1.746,0.607,p=0.00781,lung fibroblasts,in vitro,WT,human,Fibroblasts
GSE287646,Senescent1_vs_Control1,1.899,0.401,p=0.00002,human ASC52telo mesenchymal stem cells,in vitro,wildtype,human,Stromal
GSE294733,Senescent1_vs_Control1,-0.469,1.179,N.S.,human umbilical vein endothelial cells,in vitro,wildtype,human,Endothelial
GSE294733,Senescent2_vs_Control1,-0.629,1.184,N.S.,human umbilical vein endothelial cells,in vitro,wildtype,human,Endothelial
GSE56293,Senescent1_vs_Control1,-0.021,0.537,N.S.,human BJ foreskin fibroblasts,in vitro,wildtype,human,Fibroblasts
GSE58910,Senescent1_vs_Control1,0.485,0.342,N.S.,primary human astrocytes,in vitro,wildtype,human,Neural
GSE59966,Senescent1_vs_Control1,1.639,1.017,N.S.,human mesenchymal stromal cells,in vitro,wildtype,human,Stromal
GSE60340,Senescent2_vs_Control1,3.463,0.585,p<0.00001,MDAH041 LFS fibroblasts,in vitro,wildtype,human,Fibroblasts
GSE61130,Senescent1_vs_Control1,-1.216,0.247,p<0.00001,human IMR90 fibroblasts,in vitro,wildtype,human,Fibroblasts
GSE63577,Senescent3_vs_Control3,1.96,0.298,p<0.00001,human HFF fibroblasts,in vitro,wildtype,human,Fibroblasts
GSE94280,Senescent1_vs_Control1,-1.79,0.435,p=0.00020,human BJ fibroblast,in vitro,wildtype,human,Fibroblasts
GSE94395,Senescent1_vs_Control1,1.798,0.684,p=0.02213,human fibroblasts (IMR90 cell line),in vitro,wildtype,human,Fibroblasts
GSE99028,Senescent1_vs_Control1,0.68,0.707,N.S.,primary human fibroblasts,in vitro,wildtype,human,Fibroblasts
GSE133292,Senescent1_vs_Control1,0.264,0.469,N.S.,human foreskin fibroblasts,in vitro,wildtype,human,Fibroblasts
GSE155371,Senescent1_vs_Control1,0.965,0.237,p=0.00079,primary human oral keratinocytes,in vitro,wildtype,human,Epithelial
GSE165532,Senescent2_vs_Control2,-0.766,0.359,N.S.,human WI-38 fibroblast cell line,in vitro,wildtype,human,Fibroblasts
GSE230181,Senescent1_vs_Control1,0.132,0.562,N.S.,s1 IMR90 cell line; s1 ADSC; c1 ADSC; s1 RPTEC; c1 RPTEC; s1 HUVEC; c1 HUVEC; s1 HMVEC; c1 HMVEC,in vitro,wildtype,human,Fibroblasts
GSE230181,Senescent8_vs_Control1,-4.288,0.952,p=0.00006,IMR90 cell line,in vitro,wildtype,human,Fibroblasts
GSE230181,Senescent2_vs_Control1,-6.877,0.819,p<0.00001,IMR90 cell line,in vitro,wildtype,human,Fibroblasts
GSE230181,Senescent3_vs_Control1,-4.244,0.788,p<0.00001,IMR90 cell line,in vitro,wildtype,human,Fibroblasts
GSE230181,Senescent4_vs_Control1,-4.725,0.793,p<0.00001,IMR90 cell line,in vitro,wildtype,human,Fibroblasts
GSE230181,Senescent6_vs_Control1,-4.647,0.956,p=0.00001,IMR90 cell line,in vitro,wildtype,human,Fibroblasts
GSE230181,Senescent7_vs_Control1,-4.928,0.791,p<0.00001,IMR90 cell line,in vitro,wildtype,human,Fibroblasts
GSE230181,Senescent5_vs_Control1,-4.516,0.79,p<0.00001,IMR90 cell line,in vitro,wildtype,human,Fibroblasts
GSE230181,Senescent9_vs_Control1,-4.698,0.855,p<0.00001,IMR90 cell line,in vitro,wildtype,human,Fibroblasts
GSE230358,Senescent1_vs_Control1,0.472,0.507,N.S.,human IMR90 fibroblast cell line,in vitro,wildtype,human,Fibroblasts
GSE230358,Senescent8_vs_Control1,-6.172,1.053,p<0.00001,human IMR90 fibroblast cell line,in vitro,wildtype,human,Fibroblasts
GSE230358,Senescent2_vs_Control1,-6.043,1.048,p<0.00001,human IMR90 fibroblast cell line,in vitro,wildtype,human,Fibroblasts
GSE230358,Senescent3_vs_Control1,-6.288,1.06,p<0.00001,human IMR90 fibroblast cell line,in vitro,wildtype,human,Fibroblasts
GSE230358,Senescent4_vs_Control1,-3.212,0.817,p=0.00068,human IMR90 fibroblast cell line,in vitro,wildtype,human,Fibroblasts
GSE230358,Senescent6_vs_Control1,-3.793,1.022,p=0.00106,human IMR90 fibroblast cell line,in vitro,wildtype,human,Fibroblasts
GSE230358,Senescent7_vs_Control1,-3.618,0.819,p=0.00020,human IMR90 fibroblast cell line,in vitro,wildtype,human,Fibroblasts
GSE230358,Senescent5_vs_Control1,-5.078,1.023,p=0.00002,human IMR90 fibroblast cell line,in vitro,wildtype,human,Fibroblasts
GSE230358,Senescent9_vs_Control1,-3.628,0.818,p=0.00020,human IMR90 fibroblast cell line,in vitro,wildtype,human,Fibroblasts
GSE295083,Senescent1_vs_Control1,0.298,0.526,N.S.,human primary fibroblasts,in vitro,wildtype,human,Fibroblasts
GSE296209,Senescent1_vs_Control1,0.858,0.202,p=0.00012,human primary prostate stromal cells,in vitro,wildtype,human,Stromal
GSE76605,Senescent1_vs_Control1,0.742,1.222,N.S.,unknown,in vitro,c1 wildtype; s1 genetically edited (BRAF overexpression),human,Other
GSE84694,Senescent1_vs_Control1,-0.059,0.522,N.S.,human mesenchymal stem cells,in vitro,wildtype,human,Stromal
GSE85082,Senescent1_vs_Control1,0.367,0.766,N.S.,unknown,in vitro,wildtype,human,Other
GSE216842,Senescent1_vs_Control1,3.076,0.637,p=0.00001,human primary stromal cell line,in vitro,wildtype,human,Stromal
GSE216842,Senescent2_vs_Control2,3.03,0.433,p<0.00001,human primary stromal cell line,in vitro,wildtype,human,Stromal
GSE216842,Senescent4_vs_Control4,2.947,0.289,p<0.00001,human primary stromal cell line,in vitro,wildtype,human,Stromal
GSE252675,Senescent1_vs_Control1,-0.243,0.563,N.S.,human nucleus pulposus mesenchymal stem cells,in vitro,wildtype,human,Musculoskeletal
GSE280050,Senescent1_vs_Control1,-0.633,0.252,p=0.02398,human cardiac organoids,in vitro,wildtype,human,Other
