study,comparison,log2fc,lfcSE,padj,sample_type,origin,genotype,organism,simple_label
GSE53356,Senescent1_vs_Control1,-1.359,0.665,N.S.,human IMR90 cell line,in vitro,wildtype,human,Fibroblasts
GSE117979,Senescent1_vs_Control1,1.607,1.15,N.S.,mouse embryonic fibroblasts,in vitro,wildtype C57BL/6,mouse,Fibroblasts
GSE117979,Senescent2_vs_Control2,-2.712,1.184,p=0.04402,c2 mouse embryonic fibroblasts; c2 mouse embryonic fibroblata; s2 mouse embryonic fibroblasts,in vitro,wildtype C57BL/6,mouse,Fibroblasts
GSE117979,Senescent3_vs_Control3,-3.221,1.508,N.S.,mouse embryonic fibroblasts,in vitro,wildtype C57BL/6,mouse,Fibroblasts
GSE139575,Senescent1_vs_Control1,1.169,0.383,p=0.00805,mouse embryonic fibroblasts (MEF),in vitro,c1 wildtype C57BL/6; s1 genetically edited (overexpression of p21),mouse,Fibroblasts
GSE139575,Senescent2_vs_Control1,0.571,0.397,N.S.,mouse embryonic fibroblasts (MEF),in vitro,genetically edited (overexpression of p16),mouse,Fibroblasts
GSE169489,Senescent2_vs_Control1,5.365,1.387,p=0.00069,MEF14_Dox+_Day8,in vitro,wildtype,mouse,Fibroblasts
GSE176107,Senescent1_vs_Control1,1.446,0.335,p=0.00007,mouse tail fibroblast,in vitro,wildtype C57BL/6,mouse,Fibroblasts
GSE182731,Senescent2_vs_Control2,3.696,0.405,p<0.00001,primary mouse lung fibroblasts,in vitro,wildtype C57BL/6,mouse,Fibroblasts
GSE182731,Senescent3_vs_Control3,0.428,0.628,N.S.,primary mouse lung fibroblasts,in vitro,wildtype C57BL/6,mouse,Fibroblasts
GSE202032,Senescent1_vs_Control1,1.506,0.578,p=0.02513,mouse embryonic fibroblasts,in vitro,wildtype,mouse,Fibroblasts
GSE218683,Senescent1_vs_Control1,0.946,1.306,N.S.,mouse embryonic fibroblasts,in vitro,wildtype,mouse,Fibroblasts
GSE218683,Senescent2_vs_Control2,-0.535,1.319,N.S.,mouse embryonic fibroblasts,in vitro,wildtype,mouse,Fibroblasts
GSE229010,Senescent1_vs_Control1,2.775,0.245,p<0.00001,primary mouse adult fibroblast,in vitro,wildtype,mouse,Fibroblasts
GSE233718,Senescent1_vs_Control1,1.191,0.419,p=0.01417,mouse proximal tubular epithelial cells,in vitro,wildtype C57BL/6Rj,mouse,Epithelial
GSE247975,Senescent1_vs_Control1,1.302,0.538,p=0.04082,mouse fibro-adipogenic progenitors,in vitro,wildtype C57BL/6,mouse,Stromal
GSE278372,Senescent1_vs_Control1,0.385,0.713,N.S.,primary mouse embryonic fibroblasts,in vitro,wildtype,mouse,Fibroblasts
GSE278372,Senescent2_vs_Control2,0.552,0.604,N.S.,primary mouse embryonic fibroblasts,in vitro,wildtype,mouse,Fibroblasts
GSE279349,Senescent1_vs_Control1,0.723,0.731,N.S.,primary mouse embryonic fibroblasts,in vitro,wildtype,mouse,Fibroblasts
GSE279349,Senescent2_vs_Control1,0.816,0.731,N.S.,primary mouse embryonic fibroblasts,in vitro,wildtype,mouse,Fibroblasts
GSE160279,mouse_Senescent2_vs_Control2,2.146,1.4,N.S.,mouse embryonic fibroblasts,in vitro,wildtype,mouse,Fibroblasts
GSE179880,Senescent1_vs_Control1,0.448,0.512,N.S.,mouse skin fibroblasts,in vitro,wildtype,mouse,Fibroblasts
GSE101750,Senescent1_vs_Control1,-0.589,0.508,N.S.,human IMR90 fibroblasts,in vitro,wildtype,human,Fibroblasts
GSE103938,Senescent2_vs_Control1,-0.34,0.946,N.S.,human IMR90 fibroblasts,in vitro,wildtype,human,Fibroblasts
GSE105937,Senescent1_vs_Control1,1.129,0.95,N.S.,human IMR90 lung fibroblasts,in vitro,wildtype,human,Fibroblasts
GSE105937,Senescent2_vs_Control1,0.199,0.898,N.S.,human IMR90 lung fibroblasts,in vitro,wildtype,human,Fibroblasts
GSE109700,Senescent1_vs_Control1,-0.33,0.426,N.S.,human lung fibroblast cells,in vitro,wildtype,human,Fibroblasts
GSE124609,Senescent1_vs_Control1,0.514,1.42,N.S.,human lung fibroblasts,in vitro,wildtype,human,Fibroblasts
GSE125632,Senescent1_vs_Control1,1.355,0.802,N.S.,human bone marrow mesenchymal stromal cells,in vitro,wildtype,human,Stromal
GSE128420,Senescent1_vs_Control1,3.753,1.815,N.S.,primary normal human prostate stromal cells,in vitro,wildtype,human,Stromal
GSE130306,Senescent1_vs_Control1,-2.381,0.468,p<0.00001,human WI-38 fibroblasts,in vitro,wildtype,human,Fibroblasts
GSE132204,Senescent1_vs_Control1,-0.021,0.541,N.S.,primary human corneal endothelial cells,in vitro,wildtype,human,Endothelial
GSE132204,Senescent2_vs_Control2,-0.378,0.533,N.S.,primary human corneal endothelial cells,in vitro,wildtype,human,Endothelial
GSE132370,Senescent1_vs_Control1,-0.249,0.911,N.S.,human IMR90 fibroblasts,in vitro,wildtype,human,Fibroblasts
GSE153921,Senescent1_vs_Control1,-1.339,0.59,N.S.,human IMR90 ER:RAS cell line,in vitro,genetically edited (shRNA knockdown of XPO7),human,Fibroblasts
GSE155680,Senescent1_vs_Control1,2.981,0.834,p=0.00100,primary human umbilical vein endothelial cells,in vitro,wildtype,human,Endothelial
GSE155903,Senescent1_vs_Control1,-0.467,0.438,N.S.,IMR90 ER:RAS cell line,in vitro,genetically edited (ER:RAS),human,Fibroblasts
GSE157867,Senescent1_vs_Control1,1.158,1.224,N.S.,human umbilical vein endothelial cell,in vitro,wildtype,human,Endothelial
GSE165406,Senescent1_vs_Control1,-1.299,0.39,p=0.00401,human umbilical vein endothelial cells,in vitro,c1 wildtype; s1 genetically edited (siRNA knockdown of CCM2),human,Endothelial
GSE166035,Senescent1_vs_Control1,1.334,0.393,p=0.00317,primary small airway epithelial cells,in vitro,wildtype,human,Epithelial
GSE166035,Senescent2_vs_Control2,0.724,0.3,p=0.02809,primary small airway epithelial cells,in vitro,wildtype,human,Epithelial
GSE166059,Senescent1_vs_Control1,1.335,0.366,p=0.00084,human SAEC cells,in vitro,wildtype,human,Other
GSE166059,Senescent2_vs_Control2,1.056,0.306,p=0.00113,human SAEC cells,in vitro,wildtype,human,Other
GSE171780,Senescent1_vs_Control1,-4.067,1.107,p=0.00071,human fibroblast cell line IMR90,in vitro,wildtype,human,Fibroblasts
GSE176199,Senescent1_vs_Control1,0.382,0.33,N.S.,human cartilage mesenchymal stromal cells,in vitro,wildtype,human,Chondrocytes
GSE176324,Senescent1_vs_Control1,0.479,0.39,N.S.,primary human pancreatic islets,in vitro,wildtype,human,Pancreatic
GSE180361,Senescent1_vs_Control1,1.594,0.93,N.S.,human IMR90 fibroblasts,in vitro,s1 p16 overexpression; c1 wildtype,human,Fibroblasts
GSE180361,Senescent2_vs_Control2,-0.925,0.64,N.S.,human keratinocytes,in vitro,s2 HRAS G12V overexpression; c2 wildtype,human,Epithelial
GSE180406,Senescent1_vs_Control1,0.833,0.752,N.S.,human MRC-5 cell line,in vitro,wildtype,human,Other
GSE184892,Senescent1_vs_Control1,1.123,1.537,N.S.,human primary fibroblast,in vitro,wildtype,human,Fibroblasts
GSE207816,Senescent1_vs_Control1,-0.481,0.457,N.S.,human pancreatic beta cells,in vitro,wildtype,human,Pancreatic
GSE214409,Senescent1_vs_Control1,-0.587,0.712,N.S.,primary human IMR90 fibroblasts,in vitro,c1 wildtype; s1 HRasV12 overexpression,human,Fibroblasts
GSE221104,Senescent1_vs_Control1,2.13,0.824,p=0.01815,human WI-38 fibroblast cell line,in vitro,wildtype,human,Fibroblasts
GSE234417,Senescent1_vs_Control1,0.212,0.453,N.S.,WI-38 cells,in vitro,wildtype,human,Fibroblasts
GSE245147,Senescent1_vs_Control1,-4.276,1.574,p=0.01647,human nucleus pulposus cells,in vitro,wildtype,human,Musculoskeletal
GSE246073,Senescent1_vs_Control1,1.452,1.17,N.S.,human astrocytes derived from hESC,in vitro,wildtype,human,Neural
GSE250224,Senescent1_vs_Control1,-0.515,2.205,N.S.,human corneal endothelial cell,in vitro,wildtype,human,Endothelial
GSE251814,Senescent1_vs_Control1,0.112,0.263,N.S.,human induced pluripotent stem cells,in vitro,genetically edited (inducible CRISPRi targeting TERF2),human,Other
GSE264316,Senescent1_vs_Control1,-0.513,2.424,N.S.,human primary prostate stromal cell line,in vitro,wildtype,human,Stromal
GSE268487,Senescent1_vs_Control1,-2.559,0.591,p=0.00004,human lung fibroblasts,in vitro,wildtype,human,Fibroblasts
GSE269856,Senescent1_vs_Control1,3.291,1.682,N.S.,human primary lung fibroblasts,in vitro,wildtype,human,Fibroblasts
GSE274295,Senescent1_vs_Control1,4.924,2.092,p=0.03250,Human embryonic lung fibroblasts,in vitro,wildtype,human,Fibroblasts
GSE275256,Senescent1_vs_Control1,0.177,0.324,N.S.,human immortalized microglia cell line,in vitro,wildtype,human,Neural
GSE280365,Senescent1_vs_Control1,-1.804,0.401,p=0.00002,lung fibroblasts,in vitro,WT,human,Fibroblasts
GSE294733,Senescent1_vs_Control1,3.441,0.935,p=0.00135,human umbilical vein endothelial cells,in vitro,wildtype,human,Endothelial
GSE294733,Senescent2_vs_Control1,3.687,0.932,p=0.00047,human umbilical vein endothelial cells,in vitro,wildtype,human,Endothelial
GSE58910,Senescent1_vs_Control1,-0.633,0.635,N.S.,primary human astrocytes,in vitro,wildtype,human,Neural
GSE60340,Senescent2_vs_Control1,3.772,2.879,N.S.,MDAH041 LFS fibroblasts,in vitro,wildtype,human,Fibroblasts
GSE61130,Senescent1_vs_Control1,-0.037,0.489,N.S.,human IMR90 fibroblasts,in vitro,wildtype,human,Fibroblasts
GSE63577,Senescent3_vs_Control3,4.745,1.29,p=0.00121,human HFF fibroblasts,in vitro,wildtype,human,Fibroblasts
GSE75643,Senescent1_vs_Control1,-2.347,0.628,p=0.00094,diploid embryonic lung fibroblasts,in vitro,c1 wildtype; s1 genetically edited (BRAF V600E overexpression),human,Fibroblasts
GSE94395,Senescent1_vs_Control1,0.025,0.617,N.S.,human fibroblasts (IMR90 cell line),in vitro,wildtype,human,Fibroblasts
GSE99028,Senescent1_vs_Control1,1.583,1.506,N.S.,primary human fibroblasts,in vitro,wildtype,human,Fibroblasts
GSE133292,Senescent1_vs_Control1,0.137,0.779,N.S.,human foreskin fibroblasts,in vitro,wildtype,human,Fibroblasts
GSE155371,Senescent1_vs_Control1,-1.559,0.628,N.S.,primary human oral keratinocytes,in vitro,wildtype,human,Epithelial
GSE165532,Senescent2_vs_Control2,1.818,0.699,p=0.01693,human WI-38 fibroblast cell line,in vitro,wildtype,human,Fibroblasts
GSE230181,Senescent1_vs_Control1,0.536,0.438,N.S.,s1 IMR90 cell line; s1 ADSC; c1 ADSC; s1 RPTEC; c1 RPTEC; s1 HUVEC; c1 HUVEC; s1 HMVEC; c1 HMVEC,in vitro,wildtype,human,Fibroblasts
GSE230181,Senescent8_vs_Control1,-0.77,0.77,N.S.,IMR90 cell line,in vitro,wildtype,human,Fibroblasts
GSE230181,Senescent2_vs_Control1,-1.154,0.668,N.S.,IMR90 cell line,in vitro,wildtype,human,Fibroblasts
GSE230181,Senescent3_vs_Control1,-0.585,0.633,N.S.,IMR90 cell line,in vitro,wildtype,human,Fibroblasts
GSE230181,Senescent4_vs_Control1,-0.583,0.647,N.S.,IMR90 cell line,in vitro,wildtype,human,Fibroblasts
GSE230181,Senescent6_vs_Control1,-1.006,0.8,N.S.,IMR90 cell line,in vitro,wildtype,human,Fibroblasts
GSE230181,Senescent7_vs_Control1,-1.141,0.657,N.S.,IMR90 cell line,in vitro,wildtype,human,Fibroblasts
GSE230181,Senescent5_vs_Control1,-0.534,0.635,N.S.,IMR90 cell line,in vitro,wildtype,human,Fibroblasts
GSE230181,Senescent9_vs_Control1,-0.669,0.683,N.S.,IMR90 cell line,in vitro,wildtype,human,Fibroblasts
GSE230358,Senescent1_vs_Control1,1.051,0.413,p=0.04314,human IMR90 fibroblast cell line,in vitro,wildtype,human,Fibroblasts
GSE230358,Senescent8_vs_Control1,-3.805,1.406,p=0.03821,human IMR90 fibroblast cell line,in vitro,wildtype,human,Fibroblasts
GSE230358,Senescent2_vs_Control1,-0.9,0.916,N.S.,human IMR90 fibroblast cell line,in vitro,wildtype,human,Fibroblasts
GSE230358,Senescent3_vs_Control1,-0.501,0.892,N.S.,human IMR90 fibroblast cell line,in vitro,wildtype,human,Fibroblasts
GSE230358,Senescent4_vs_Control1,0.424,0.661,N.S.,human IMR90 fibroblast cell line,in vitro,wildtype,human,Fibroblasts
GSE230358,Senescent6_vs_Control1,-0.343,0.928,N.S.,human IMR90 fibroblast cell line,in vitro,wildtype,human,Fibroblasts
GSE230358,Senescent7_vs_Control1,0.422,0.666,N.S.,human IMR90 fibroblast cell line,in vitro,wildtype,human,Fibroblasts
GSE230358,Senescent5_vs_Control1,-0.088,0.837,N.S.,human IMR90 fibroblast cell line,in vitro,wildtype,human,Fibroblasts
GSE230358,Senescent9_vs_Control1,-0.006,0.674,N.S.,human IMR90 fibroblast cell line,in vitro,wildtype,human,Fibroblasts
GSE296209,Senescent1_vs_Control1,-0.017,2.02,N.S.,human primary prostate stromal cells,in vitro,wildtype,human,Stromal
GSE76605,Senescent1_vs_Control1,-2.051,0.443,p=0.00003,unknown,in vitro,c1 wildtype; s1 genetically edited (BRAF overexpression),human,Other
GSE84694,Senescent1_vs_Control1,0.643,1.456,N.S.,human mesenchymal stem cells,in vitro,wildtype,human,Stromal
GSE216842,Senescent1_vs_Control1,1.162,1.456,N.S.,human primary stromal cell line,in vitro,wildtype,human,Stromal
GSE216842,Senescent2_vs_Control2,0.842,0.99,N.S.,human primary stromal cell line,in vitro,wildtype,human,Stromal
GSE216842,Senescent4_vs_Control4,1.018,1.195,N.S.,human primary stromal cell line,in vitro,wildtype,human,Stromal
GSE280050,Senescent1_vs_Control1,0.448,0.25,N.S.,human cardiac organoids,in vitro,wildtype,human,Other
