study,comparison,log2fc,lfcSE,padj,sample_type,origin,genotype,organism,simple_label
GSE130099,Senescent1_vs_Control1,-0.29,0.053,p<0.00001,human BJ-TERT fibroblasts,in vitro,c1 genetically edited (TERT overexpression); s1 genetically edited (TERT overexpression; myrAKT1 overexpression),human,Fibroblasts
GSE212085,Senescent1_vs_Control1,-0.145,0.059,p=0.02625,human foetal lung fibroblast cell line IMR-90,in vitro,wildtype,human,Fibroblasts
GSE224071,Senescent1_vs_Control1,-0.056,0.137,N.S.,human lung fibroblast cell line,in vitro,wildtype,human,Fibroblasts
GSE53356,Senescent1_vs_Control1,-0.219,0.033,p<0.00001,human IMR90 cell line,in vitro,wildtype,human,Fibroblasts
GSE117208,Senescent1_vs_Control1,0.219,0.532,N.S.,mouse embryonic fibroblasts (MEFs),in vitro,wildtype C57BL/6,mouse,Fibroblasts
GSE117979,Senescent1_vs_Control1,0.298,0.084,p=0.00151,mouse embryonic fibroblasts,in vitro,wildtype C57BL/6,mouse,Fibroblasts
GSE117979,Senescent2_vs_Control2,0.112,0.084,N.S.,c2 mouse embryonic fibroblasts; c2 mouse embryonic fibroblata; s2 mouse embryonic fibroblasts,in vitro,wildtype C57BL/6,mouse,Fibroblasts
GSE117979,Senescent3_vs_Control3,0.454,0.084,p<0.00001,mouse embryonic fibroblasts,in vitro,wildtype C57BL/6,mouse,Fibroblasts
GSE139575,Senescent1_vs_Control1,0.104,0.053,N.S.,mouse embryonic fibroblasts (MEF),in vitro,c1 wildtype C57BL/6; s1 genetically edited (overexpression of p21),mouse,Fibroblasts
GSE139575,Senescent2_vs_Control1,0.079,0.053,N.S.,mouse embryonic fibroblasts (MEF),in vitro,genetically edited (overexpression of p16),mouse,Fibroblasts
GSE169489,Senescent2_vs_Control1,0.156,0.224,N.S.,MEF14_Dox+_Day8,in vitro,wildtype,mouse,Fibroblasts
GSE176107,Senescent1_vs_Control1,0.079,0.094,N.S.,mouse tail fibroblast,in vitro,wildtype C57BL/6,mouse,Fibroblasts
GSE182731,Senescent2_vs_Control2,-0.45,0.215,N.S.,primary mouse lung fibroblasts,in vitro,wildtype C57BL/6,mouse,Fibroblasts
GSE182731,Senescent3_vs_Control3,0.207,0.25,N.S.,primary mouse lung fibroblasts,in vitro,wildtype C57BL/6,mouse,Fibroblasts
GSE202032,Senescent1_vs_Control1,-0.063,0.075,N.S.,mouse embryonic fibroblasts,in vitro,wildtype,mouse,Fibroblasts
GSE210362,Senescent1_vs_Control1,0.493,0.072,p<0.00001,murine embryonic fibroblasts,in vitro,c1 wildtype; s1 genetically edited (Myc knockout),mouse,Fibroblasts
GSE218683,Senescent1_vs_Control1,-0.259,0.112,N.S.,mouse embryonic fibroblasts,in vitro,wildtype,mouse,Fibroblasts
GSE218683,Senescent2_vs_Control2,-0.048,0.112,N.S.,mouse embryonic fibroblasts,in vitro,wildtype,mouse,Fibroblasts
GSE218684,Senescent1_vs_Control1,0.104,0.314,N.S.,mouse embryonic fibroblast,in vitro,wildtype,mouse,Fibroblasts
GSE218684,Senescent2_vs_Control2,-0.094,0.313,N.S.,mouse embryonic fibroblast,in vitro,wildtype,mouse,Fibroblasts
GSE219126,Senescent1_vs_Control1,0.274,0.121,N.S.,mouse intestinal organoids,in vitro,wildtype C57BL/6,mouse,Other
GSE229010,Senescent1_vs_Control1,0.172,0.071,p=0.02748,primary mouse adult fibroblast,in vitro,wildtype,mouse,Fibroblasts
GSE233718,Senescent1_vs_Control1,-0.014,0.22,N.S.,mouse proximal tubular epithelial cells,in vitro,wildtype C57BL/6Rj,mouse,Epithelial
GSE247975,Senescent1_vs_Control1,-0.167,0.104,N.S.,mouse fibro-adipogenic progenitors,in vitro,wildtype C57BL/6,mouse,Stromal
GSE278372,Senescent1_vs_Control1,0.011,0.154,N.S.,primary mouse embryonic fibroblasts,in vitro,wildtype,mouse,Fibroblasts
GSE278372,Senescent2_vs_Control2,0.079,0.133,N.S.,primary mouse embryonic fibroblasts,in vitro,wildtype,mouse,Fibroblasts
GSE279349,Senescent1_vs_Control1,-0.015,0.091,N.S.,primary mouse embryonic fibroblasts,in vitro,wildtype,mouse,Fibroblasts
GSE279349,Senescent2_vs_Control1,0.113,0.091,N.S.,primary mouse embryonic fibroblasts,in vitro,wildtype,mouse,Fibroblasts
GSE281894,Senescent1_vs_Control1,0.161,0.193,N.S.,podocytes,in vitro,wildtype,mouse,Renal
GSE160279,mouse_Senescent2_vs_Control2,0.085,0.244,N.S.,mouse embryonic fibroblasts,in vitro,wildtype,mouse,Fibroblasts
GSE179880,Senescent1_vs_Control1,0.438,0.101,p=0.00008,mouse skin fibroblasts,in vitro,wildtype,mouse,Fibroblasts
GSE201217,Senescent1_vs_Control1,-0.072,0.476,N.S.,primary PWK mouse cells,in vitro,wildtype,mouse,Other
GSE247607,human_Senescent1_vs_Control1,-0.058,0.059,N.S.,human IMR-90 fibroblast cell line,in vitro,wildtype,human,Fibroblasts
GSE101750,Senescent1_vs_Control1,0.03,0.104,N.S.,human IMR90 fibroblasts,in vitro,wildtype,human,Fibroblasts
GSE103938,Senescent2_vs_Control1,0.38,0.381,N.S.,human IMR90 fibroblasts,in vitro,wildtype,human,Fibroblasts
GSE105937,Senescent1_vs_Control1,0.219,0.356,N.S.,human IMR90 lung fibroblasts,in vitro,wildtype,human,Fibroblasts
GSE105937,Senescent2_vs_Control1,-0.712,0.325,N.S.,human IMR90 lung fibroblasts,in vitro,wildtype,human,Fibroblasts
GSE108278,Senescent1_vs_Control1,-0.279,0.098,p=0.00949,IMR90 hTERT lung fibroblast,in vitro,wildtype,human,Fibroblasts
GSE109700,Senescent1_vs_Control1,-0.168,0.137,N.S.,human lung fibroblast cells,in vitro,wildtype,human,Fibroblasts
GSE118583,Senescent1_vs_Control1,-0.312,0.084,p=0.00073,human lung fibroblast cell line IMR-90,in vitro,wildtype,human,Fibroblasts
GSE124609,Senescent1_vs_Control1,0.015,0.381,N.S.,human lung fibroblasts,in vitro,wildtype,human,Fibroblasts
GSE125632,Senescent1_vs_Control1,-0.025,0.178,N.S.,human bone marrow mesenchymal stromal cells,in vitro,wildtype,human,Stromal
GSE128420,Senescent1_vs_Control1,0.531,0.086,p<0.00001,primary normal human prostate stromal cells,in vitro,wildtype,human,Stromal
GSE130306,Senescent1_vs_Control1,-0.294,0.11,p=0.01786,human WI-38 fibroblasts,in vitro,wildtype,human,Fibroblasts
GSE132204,Senescent1_vs_Control1,-0.086,0.07,N.S.,primary human corneal endothelial cells,in vitro,wildtype,human,Endothelial
GSE132204,Senescent2_vs_Control2,0.19,0.069,p=0.02523,primary human corneal endothelial cells,in vitro,wildtype,human,Endothelial
GSE132370,Senescent1_vs_Control1,-0.251,0.142,N.S.,human IMR90 fibroblasts,in vitro,wildtype,human,Fibroblasts
GSE144752,Senescent1_vs_Control1,0.175,0.097,N.S.,BJ hTERT fibroblast,in vitro,wildtype,human,Fibroblasts
GSE153921,Senescent1_vs_Control1,0.016,0.09,N.S.,human IMR90 ER:RAS cell line,in vitro,genetically edited (shRNA knockdown of XPO7),human,Fibroblasts
GSE155680,Senescent1_vs_Control1,0.04,0.08,N.S.,primary human umbilical vein endothelial cells,in vitro,wildtype,human,Endothelial
GSE155903,Senescent1_vs_Control1,-0.301,0.164,N.S.,IMR90 ER:RAS cell line,in vitro,genetically edited (ER:RAS),human,Fibroblasts
GSE156038,Senescent1_vs_Control1,-0.471,0.088,p<0.00001,human prostate primary stromal cells,in vitro,wildtype,human,Stromal
GSE156184,Senescent1_vs_Control1,-0.471,0.088,p<0.00001,Normal human prostate derived primary stromal cells,in vitro,wildtype,human,Stromal
GSE156472,Senescent1_vs_Control1,-0.471,0.088,p<0.00001,primary human prostate stromal cells,in vitro,wildtype,human,Stromal
GSE157867,Senescent1_vs_Control1,-0.148,0.188,N.S.,human umbilical vein endothelial cell,in vitro,wildtype,human,Endothelial
GSE160273,Senescent1_vs_Control1,0.016,0.084,N.S.,human bone mesenchymal stem cells,in vitro,wildtype,human,Stromal
GSE160702,Senescent1_vs_Control1,-0.507,0.067,p<0.00001,human endometrial stromal cells,in vitro,wildtype,human,Stromal
GSE165406,Senescent1_vs_Control1,-0.239,0.113,N.S.,human umbilical vein endothelial cells,in vitro,c1 wildtype; s1 genetically edited (siRNA knockdown of CCM2),human,Endothelial
GSE166035,Senescent1_vs_Control1,-0.214,0.169,N.S.,primary small airway epithelial cells,in vitro,wildtype,human,Epithelial
GSE166035,Senescent2_vs_Control2,-0.328,0.145,p=0.04053,primary small airway epithelial cells,in vitro,wildtype,human,Epithelial
GSE166059,Senescent1_vs_Control1,-0.216,0.065,p=0.00252,human SAEC cells,in vitro,wildtype,human,Other
GSE166059,Senescent2_vs_Control2,-0.614,0.061,p<0.00001,human SAEC cells,in vitro,wildtype,human,Other
GSE168994,Senescent1_vs_Control1,-0.087,0.075,N.S.,human lung fibroblast,in vitro,wildtype,human,Fibroblasts
GSE171780,Senescent1_vs_Control1,0.278,0.082,p=0.00182,human fibroblast cell line IMR90,in vitro,wildtype,human,Fibroblasts
GSE176199,Senescent1_vs_Control1,-0.032,0.066,N.S.,human cartilage mesenchymal stromal cells,in vitro,wildtype,human,Chondrocytes
GSE176324,Senescent1_vs_Control1,-0.253,0.092,p=0.04334,primary human pancreatic islets,in vitro,wildtype,human,Pancreatic
GSE180361,Senescent1_vs_Control1,0.084,0.071,N.S.,human IMR90 fibroblasts,in vitro,s1 p16 overexpression; c1 wildtype,human,Fibroblasts
GSE180361,Senescent2_vs_Control2,-0.302,0.053,p<0.00001,human keratinocytes,in vitro,s2 HRAS G12V overexpression; c2 wildtype,human,Epithelial
GSE180406,Senescent1_vs_Control1,-0.118,0.136,N.S.,human MRC-5 cell line,in vitro,wildtype,human,Other
GSE184892,Senescent1_vs_Control1,-0.121,0.063,N.S.,human primary fibroblast,in vitro,wildtype,human,Fibroblasts
GSE198396,Senescent1_vs_Control1,-0.253,0.107,p=0.04384,human foreskin fibroblast cell line HCA2,in vitro,wildtype,human,Fibroblasts
GSE207816,Senescent1_vs_Control1,0.033,0.229,N.S.,human pancreatic beta cells,in vitro,wildtype,human,Pancreatic
GSE214409,Senescent1_vs_Control1,0.216,0.07,p=0.00421,primary human IMR90 fibroblasts,in vitro,c1 wildtype; s1 HRasV12 overexpression,human,Fibroblasts
GSE221104,Senescent1_vs_Control1,-0.114,0.052,p=0.04950,human WI-38 fibroblast cell line,in vitro,wildtype,human,Fibroblasts
GSE222400,Senescent1_vs_Control1,-0.03,0.119,N.S.,human lung fibroblast cells,in vitro,wildtype,human,Fibroblasts
GSE222400,Senescent2_vs_Control2,-0.047,0.108,N.S.,human lung fibroblast cells,in vitro,wildtype,human,Fibroblasts
GSE226005,Senescent1_vs_Control1,-0.966,0.095,p<0.00001,fibroblast cell line,in vitro,wildtype,human,Fibroblasts
GSE234417,Senescent1_vs_Control1,-0.11,0.078,N.S.,WI-38 cells,in vitro,wildtype,human,Fibroblasts
GSE235768,Senescent1_vs_Control1,-0.224,0.277,N.S.,human normal skin fibroblasts,in vitro,wildtype,human,Fibroblasts
GSE235768,Senescent2_vs_Control2,-0.545,0.275,N.S.,human normal skin fibroblasts,in vitro,wildtype,human,Fibroblasts
GSE235768,Senescent3_vs_Control3,-0.766,0.273,p=0.02438,human normal lung fibroblasts,in vitro,wildtype,human,Fibroblasts
GSE235768,Senescent4_vs_Control4,0.237,0.265,N.S.,human normal lung fibroblasts,in vitro,wildtype,human,Fibroblasts
GSE238252,Senescent1_vs_Control1,-0.12,0.39,N.S.,human lung fibroblast,in vitro,wildtype,human,Fibroblasts
GSE238254,Senescent1_vs_Control1,-0.428,0.201,N.S.,human lung fibroblast,in vitro,wildtype,human,Fibroblasts
GSE245045,Senescent1_vs_Control1,0.039,0.182,N.S.,primary dermal fibroblast,in vitro,wildtype,human,Fibroblasts
GSE245147,Senescent1_vs_Control1,-0.204,0.093,N.S.,human nucleus pulposus cells,in vitro,wildtype,human,Musculoskeletal
GSE246073,Senescent1_vs_Control1,0.157,0.281,N.S.,human astrocytes derived from hESC,in vitro,wildtype,human,Neural
GSE250224,Senescent1_vs_Control1,-0.165,0.065,p=0.02213,human corneal endothelial cell,in vitro,wildtype,human,Endothelial
GSE250224,Senescent2_vs_Control1,-0.163,0.065,p=0.03048,human corneal endothelial cell,in vitro,wildtype,human,Endothelial
GSE251814,Senescent1_vs_Control1,-0.038,0.088,N.S.,human induced pluripotent stem cells,in vitro,genetically edited (inducible CRISPRi targeting TERF2),human,Other
GSE264316,Senescent1_vs_Control1,-0.626,0.064,p<0.00001,human primary prostate stromal cell line,in vitro,wildtype,human,Stromal
GSE268487,Senescent1_vs_Control1,0.527,0.132,p=0.00017,human lung fibroblasts,in vitro,wildtype,human,Fibroblasts
GSE269856,Senescent1_vs_Control1,-0.259,0.371,N.S.,human primary lung fibroblasts,in vitro,wildtype,human,Fibroblasts
GSE274295,Senescent1_vs_Control1,0.16,0.075,N.S.,Human embryonic lung fibroblasts,in vitro,wildtype,human,Fibroblasts
GSE275256,Senescent1_vs_Control1,-0.258,0.062,p=0.00015,human immortalized microglia cell line,in vitro,wildtype,human,Neural
GSE280365,Senescent1_vs_Control1,-0.411,0.123,p=0.00186,lung fibroblasts,in vitro,WT,human,Fibroblasts
GSE287646,Senescent1_vs_Control1,-0.14,0.089,N.S.,human ASC52telo mesenchymal stem cells,in vitro,wildtype,human,Stromal
GSE294733,Senescent1_vs_Control1,-0.675,0.267,p=0.03901,human umbilical vein endothelial cells,in vitro,wildtype,human,Endothelial
GSE294733,Senescent2_vs_Control1,-0.366,0.264,N.S.,human umbilical vein endothelial cells,in vitro,wildtype,human,Endothelial
GSE56293,Senescent1_vs_Control1,-0.202,0.142,N.S.,human BJ foreskin fibroblasts,in vitro,wildtype,human,Fibroblasts
GSE58910,Senescent1_vs_Control1,-0.308,0.123,p=0.03639,primary human astrocytes,in vitro,wildtype,human,Neural
GSE59966,Senescent1_vs_Control1,0.07,0.14,N.S.,human mesenchymal stromal cells,in vitro,wildtype,human,Stromal
GSE60340,Senescent2_vs_Control1,-0.979,0.16,p<0.00001,MDAH041 LFS fibroblasts,in vitro,wildtype,human,Fibroblasts
GSE61130,Senescent1_vs_Control1,0.009,0.065,N.S.,human IMR90 fibroblasts,in vitro,wildtype,human,Fibroblasts
GSE63577,Senescent3_vs_Control3,0.054,0.108,N.S.,human HFF fibroblasts,in vitro,wildtype,human,Fibroblasts
GSE75643,Senescent1_vs_Control1,0.134,0.175,N.S.,diploid embryonic lung fibroblasts,in vitro,c1 wildtype; s1 genetically edited (BRAF V600E overexpression),human,Fibroblasts
GSE94280,Senescent1_vs_Control1,-0.154,0.076,N.S.,human BJ fibroblast,in vitro,wildtype,human,Fibroblasts
GSE94395,Senescent1_vs_Control1,-0.344,0.077,p=0.00003,human fibroblasts (IMR90 cell line),in vitro,wildtype,human,Fibroblasts
GSE99028,Senescent1_vs_Control1,-0.01,0.471,N.S.,primary human fibroblasts,in vitro,wildtype,human,Fibroblasts
GSE133292,Senescent1_vs_Control1,-0.225,0.107,N.S.,human foreskin fibroblasts,in vitro,wildtype,human,Fibroblasts
GSE155371,Senescent1_vs_Control1,0.319,0.165,N.S.,primary human oral keratinocytes,in vitro,wildtype,human,Epithelial
GSE165532,Senescent2_vs_Control2,-0.342,0.062,p<0.00001,human WI-38 fibroblast cell line,in vitro,wildtype,human,Fibroblasts
GSE230181,Senescent1_vs_Control1,0.172,0.125,N.S.,s1 IMR90 cell line; s1 ADSC; c1 ADSC; s1 RPTEC; c1 RPTEC; s1 HUVEC; c1 HUVEC; s1 HMVEC; c1 HMVEC,in vitro,wildtype,human,Fibroblasts
GSE230181,Senescent8_vs_Control1,0.377,0.21,N.S.,IMR90 cell line,in vitro,wildtype,human,Fibroblasts
GSE230181,Senescent2_vs_Control1,0.595,0.174,p=0.00190,IMR90 cell line,in vitro,wildtype,human,Fibroblasts
GSE230181,Senescent3_vs_Control1,0.405,0.174,p=0.04591,IMR90 cell line,in vitro,wildtype,human,Fibroblasts
GSE230181,Senescent4_vs_Control1,0.48,0.174,p=0.01619,IMR90 cell line,in vitro,wildtype,human,Fibroblasts
GSE230181,Senescent6_vs_Control1,0.312,0.21,N.S.,IMR90 cell line,in vitro,wildtype,human,Fibroblasts
GSE230181,Senescent7_vs_Control1,0.258,0.174,N.S.,IMR90 cell line,in vitro,wildtype,human,Fibroblasts
GSE230181,Senescent5_vs_Control1,0.455,0.174,p=0.02262,IMR90 cell line,in vitro,wildtype,human,Fibroblasts
GSE230181,Senescent9_vs_Control1,0.552,0.188,p=0.00998,IMR90 cell line,in vitro,wildtype,human,Fibroblasts
GSE230358,Senescent1_vs_Control1,0.129,0.104,N.S.,human IMR90 fibroblast cell line,in vitro,wildtype,human,Fibroblasts
GSE230358,Senescent8_vs_Control1,0.109,0.206,N.S.,human IMR90 fibroblast cell line,in vitro,wildtype,human,Fibroblasts
GSE230358,Senescent2_vs_Control1,0.433,0.205,N.S.,human IMR90 fibroblast cell line,in vitro,wildtype,human,Fibroblasts
GSE230358,Senescent3_vs_Control1,0.529,0.205,p=0.02763,human IMR90 fibroblast cell line,in vitro,wildtype,human,Fibroblasts
GSE230358,Senescent4_vs_Control1,0.167,0.166,N.S.,human IMR90 fibroblast cell line,in vitro,wildtype,human,Fibroblasts
GSE230358,Senescent6_vs_Control1,0.487,0.206,p=0.04878,human IMR90 fibroblast cell line,in vitro,wildtype,human,Fibroblasts
GSE230358,Senescent7_vs_Control1,0.183,0.166,N.S.,human IMR90 fibroblast cell line,in vitro,wildtype,human,Fibroblasts
GSE230358,Senescent5_vs_Control1,0.354,0.205,N.S.,human IMR90 fibroblast cell line,in vitro,wildtype,human,Fibroblasts
GSE230358,Senescent9_vs_Control1,0.168,0.166,N.S.,human IMR90 fibroblast cell line,in vitro,wildtype,human,Fibroblasts
GSE295083,Senescent1_vs_Control1,0.357,0.494,N.S.,human primary fibroblasts,in vitro,wildtype,human,Fibroblasts
GSE296209,Senescent1_vs_Control1,-0.102,0.084,N.S.,human primary prostate stromal cells,in vitro,wildtype,human,Stromal
GSE76605,Senescent1_vs_Control1,0.125,0.131,N.S.,unknown,in vitro,c1 wildtype; s1 genetically edited (BRAF overexpression),human,Other
GSE84694,Senescent1_vs_Control1,-0.296,0.133,N.S.,human mesenchymal stem cells,in vitro,wildtype,human,Stromal
GSE85082,Senescent1_vs_Control1,0.176,0.38,N.S.,unknown,in vitro,wildtype,human,Other
GSE216842,Senescent1_vs_Control1,-0.244,0.051,p=0.00001,human primary stromal cell line,in vitro,wildtype,human,Stromal
GSE216842,Senescent2_vs_Control2,0.203,0.058,p=0.00116,human primary stromal cell line,in vitro,wildtype,human,Stromal
GSE216842,Senescent4_vs_Control4,-0.23,0.049,p=0.00001,human primary stromal cell line,in vitro,wildtype,human,Stromal
GSE252675,Senescent1_vs_Control1,-0.012,0.113,N.S.,human nucleus pulposus mesenchymal stem cells,in vitro,wildtype,human,Musculoskeletal
GSE280050,Senescent1_vs_Control1,0.062,0.111,N.S.,human cardiac organoids,in vitro,wildtype,human,Other
