study,comparison,log2fc,lfcSE,padj,sample_type,origin,genotype,organism,simple_label
GSE53356,Senescent1_vs_Control1,-1.617,0.062,p<0.00001,human IMR90 cell line,in vitro,wildtype,human,Fibroblasts
GSE117208,Senescent1_vs_Control1,-0.757,0.535,N.S.,mouse embryonic fibroblasts (MEFs),in vitro,wildtype C57BL/6,mouse,Fibroblasts
GSE117979,Senescent1_vs_Control1,-0.694,0.211,p=0.00338,mouse embryonic fibroblasts,in vitro,wildtype C57BL/6,mouse,Fibroblasts
GSE117979,Senescent2_vs_Control2,-0.837,0.212,p=0.00028,c2 mouse embryonic fibroblasts; c2 mouse embryonic fibroblata; s2 mouse embryonic fibroblasts,in vitro,wildtype C57BL/6,mouse,Fibroblasts
GSE117979,Senescent3_vs_Control3,-1.533,0.212,p<0.00001,mouse embryonic fibroblasts,in vitro,wildtype C57BL/6,mouse,Fibroblasts
GSE139575,Senescent1_vs_Control1,0.127,0.096,N.S.,mouse embryonic fibroblasts (MEF),in vitro,c1 wildtype C57BL/6; s1 genetically edited (overexpression of p21),mouse,Fibroblasts
GSE139575,Senescent2_vs_Control1,0.123,0.096,N.S.,mouse embryonic fibroblasts (MEF),in vitro,genetically edited (overexpression of p16),mouse,Fibroblasts
GSE169489,Senescent2_vs_Control1,0.085,0.389,N.S.,MEF14_Dox+_Day8,in vitro,wildtype,mouse,Fibroblasts
GSE176107,Senescent1_vs_Control1,-0.321,0.134,p=0.03923,mouse tail fibroblast,in vitro,wildtype C57BL/6,mouse,Fibroblasts
GSE182731,Senescent2_vs_Control2,0.134,0.14,N.S.,primary mouse lung fibroblasts,in vitro,wildtype C57BL/6,mouse,Fibroblasts
GSE182731,Senescent3_vs_Control3,-0.703,0.168,p=0.00016,primary mouse lung fibroblasts,in vitro,wildtype C57BL/6,mouse,Fibroblasts
GSE202032,Senescent1_vs_Control1,-0.74,0.164,p=0.00005,mouse embryonic fibroblasts,in vitro,wildtype,mouse,Fibroblasts
GSE210362,Senescent1_vs_Control1,-0.192,0.132,N.S.,murine embryonic fibroblasts,in vitro,c1 wildtype; s1 genetically edited (Myc knockout),mouse,Fibroblasts
GSE218683,Senescent1_vs_Control1,0.129,0.137,N.S.,mouse embryonic fibroblasts,in vitro,wildtype,mouse,Fibroblasts
GSE218683,Senescent2_vs_Control2,0.2,0.141,N.S.,mouse embryonic fibroblasts,in vitro,wildtype,mouse,Fibroblasts
GSE218684,Senescent1_vs_Control1,-0.191,0.155,N.S.,mouse embryonic fibroblast,in vitro,wildtype,mouse,Fibroblasts
GSE218684,Senescent2_vs_Control2,-0.274,0.155,N.S.,mouse embryonic fibroblast,in vitro,wildtype,mouse,Fibroblasts
GSE219126,Senescent1_vs_Control1,0.196,0.166,N.S.,mouse intestinal organoids,in vitro,wildtype C57BL/6,mouse,Other
GSE229010,Senescent1_vs_Control1,0.352,0.1,p=0.00096,primary mouse adult fibroblast,in vitro,wildtype,mouse,Fibroblasts
GSE233718,Senescent1_vs_Control1,-0.469,0.146,p=0.00496,mouse proximal tubular epithelial cells,in vitro,wildtype C57BL/6Rj,mouse,Epithelial
GSE247975,Senescent1_vs_Control1,-0.373,0.184,N.S.,mouse fibro-adipogenic progenitors,in vitro,wildtype C57BL/6,mouse,Stromal
GSE278372,Senescent1_vs_Control1,-0.574,0.294,N.S.,primary mouse embryonic fibroblasts,in vitro,wildtype,mouse,Fibroblasts
GSE278372,Senescent2_vs_Control2,-0.171,0.253,N.S.,primary mouse embryonic fibroblasts,in vitro,wildtype,mouse,Fibroblasts
GSE279349,Senescent1_vs_Control1,-0.102,0.16,N.S.,primary mouse embryonic fibroblasts,in vitro,wildtype,mouse,Fibroblasts
GSE279349,Senescent2_vs_Control1,-0.458,0.163,p=0.02334,primary mouse embryonic fibroblasts,in vitro,wildtype,mouse,Fibroblasts
GSE281894,Senescent1_vs_Control1,-1.074,0.236,p=0.00003,podocytes,in vitro,wildtype,mouse,Renal
GSE160279,mouse_Senescent2_vs_Control2,-0.464,0.282,N.S.,mouse embryonic fibroblasts,in vitro,wildtype,mouse,Fibroblasts
GSE179880,Senescent1_vs_Control1,-0.559,0.103,p<0.00001,mouse skin fibroblasts,in vitro,wildtype,mouse,Fibroblasts
GSE201217,Senescent1_vs_Control1,-0.255,0.542,N.S.,primary PWK mouse cells,in vitro,wildtype,mouse,Other
GSE247607,human_Senescent1_vs_Control1,-0.431,0.257,N.S.,human IMR-90 fibroblast cell line,in vitro,wildtype,human,Fibroblasts
GSE101750,Senescent1_vs_Control1,-1.476,0.237,p<0.00001,human IMR90 fibroblasts,in vitro,wildtype,human,Fibroblasts
GSE103938,Senescent2_vs_Control1,-2.215,0.399,p<0.00001,human IMR90 fibroblasts,in vitro,wildtype,human,Fibroblasts
GSE105937,Senescent1_vs_Control1,-0.962,0.286,p=0.00750,human IMR90 lung fibroblasts,in vitro,wildtype,human,Fibroblasts
GSE105937,Senescent2_vs_Control1,-1.597,0.262,p<0.00001,human IMR90 lung fibroblasts,in vitro,wildtype,human,Fibroblasts
GSE108278,Senescent1_vs_Control1,-3.01,0.198,p<0.00001,IMR90 hTERT lung fibroblast,in vitro,wildtype,human,Fibroblasts
GSE109700,Senescent1_vs_Control1,-1.832,0.176,p<0.00001,human lung fibroblast cells,in vitro,wildtype,human,Fibroblasts
GSE118583,Senescent1_vs_Control1,-0.477,0.163,p=0.00949,human lung fibroblast cell line IMR-90,in vitro,wildtype,human,Fibroblasts
GSE124609,Senescent1_vs_Control1,-0.546,0.282,N.S.,human lung fibroblasts,in vitro,wildtype,human,Fibroblasts
GSE125632,Senescent1_vs_Control1,-0.247,0.278,N.S.,human bone marrow mesenchymal stromal cells,in vitro,wildtype,human,Stromal
GSE128420,Senescent1_vs_Control1,-0.562,0.218,p=0.01783,primary normal human prostate stromal cells,in vitro,wildtype,human,Stromal
GSE130306,Senescent1_vs_Control1,-0.72,0.121,p<0.00001,human WI-38 fibroblasts,in vitro,wildtype,human,Fibroblasts
GSE132204,Senescent1_vs_Control1,-0.049,0.146,N.S.,primary human corneal endothelial cells,in vitro,wildtype,human,Endothelial
GSE132204,Senescent2_vs_Control2,0.224,0.146,N.S.,primary human corneal endothelial cells,in vitro,wildtype,human,Endothelial
GSE132370,Senescent1_vs_Control1,-1.696,0.157,p<0.00001,human IMR90 fibroblasts,in vitro,wildtype,human,Fibroblasts
GSE144752,Senescent1_vs_Control1,-0.859,0.188,p=0.00002,BJ hTERT fibroblast,in vitro,wildtype,human,Fibroblasts
GSE153921,Senescent1_vs_Control1,-1.19,0.18,p<0.00001,human IMR90 ER:RAS cell line,in vitro,genetically edited (shRNA knockdown of XPO7),human,Fibroblasts
GSE155680,Senescent1_vs_Control1,0.106,0.126,N.S.,primary human umbilical vein endothelial cells,in vitro,wildtype,human,Endothelial
GSE155903,Senescent1_vs_Control1,-1.436,0.172,p<0.00001,IMR90 ER:RAS cell line,in vitro,genetically edited (ER:RAS),human,Fibroblasts
GSE156038,Senescent1_vs_Control1,-0.218,0.237,N.S.,human prostate primary stromal cells,in vitro,wildtype,human,Stromal
GSE156184,Senescent1_vs_Control1,-0.218,0.237,N.S.,Normal human prostate derived primary stromal cells,in vitro,wildtype,human,Stromal
GSE156472,Senescent1_vs_Control1,-0.218,0.237,N.S.,primary human prostate stromal cells,in vitro,wildtype,human,Stromal
GSE157867,Senescent1_vs_Control1,-0.008,0.232,N.S.,human umbilical vein endothelial cell,in vitro,wildtype,human,Endothelial
GSE160273,Senescent1_vs_Control1,-0.667,0.167,p=0.00048,human bone mesenchymal stem cells,in vitro,wildtype,human,Stromal
GSE160702,Senescent1_vs_Control1,0.006,0.188,N.S.,human endometrial stromal cells,in vitro,wildtype,human,Stromal
GSE165406,Senescent1_vs_Control1,0.355,0.169,N.S.,human umbilical vein endothelial cells,in vitro,c1 wildtype; s1 genetically edited (siRNA knockdown of CCM2),human,Endothelial
GSE166035,Senescent1_vs_Control1,-0.096,0.105,N.S.,primary small airway epithelial cells,in vitro,wildtype,human,Epithelial
GSE166035,Senescent2_vs_Control2,0.072,0.084,N.S.,primary small airway epithelial cells,in vitro,wildtype,human,Epithelial
GSE166059,Senescent1_vs_Control1,-0.097,0.114,N.S.,human SAEC cells,in vitro,wildtype,human,Other
GSE166059,Senescent2_vs_Control2,0.063,0.108,N.S.,human SAEC cells,in vitro,wildtype,human,Other
GSE168994,Senescent1_vs_Control1,-1.273,0.163,p<0.00001,human lung fibroblast,in vitro,wildtype,human,Fibroblasts
GSE171780,Senescent1_vs_Control1,-0.544,0.177,p=0.00523,human fibroblast cell line IMR90,in vitro,wildtype,human,Fibroblasts
GSE176199,Senescent1_vs_Control1,-0.452,0.091,p<0.00001,human cartilage mesenchymal stromal cells,in vitro,wildtype,human,Chondrocytes
GSE176324,Senescent1_vs_Control1,-0.166,0.108,N.S.,primary human pancreatic islets,in vitro,wildtype,human,Pancreatic
GSE180361,Senescent1_vs_Control1,-0.978,0.183,p<0.00001,human IMR90 fibroblasts,in vitro,s1 p16 overexpression; c1 wildtype,human,Fibroblasts
GSE180361,Senescent2_vs_Control2,-0.579,0.137,p=0.00008,human keratinocytes,in vitro,s2 HRAS G12V overexpression; c2 wildtype,human,Epithelial
GSE180406,Senescent1_vs_Control1,-1.088,0.23,p=0.00001,human MRC-5 cell line,in vitro,wildtype,human,Other
GSE184892,Senescent1_vs_Control1,-0.011,0.256,N.S.,human primary fibroblast,in vitro,wildtype,human,Fibroblasts
GSE198396,Senescent1_vs_Control1,-0.781,0.215,p=0.00106,human foreskin fibroblast cell line HCA2,in vitro,wildtype,human,Fibroblasts
GSE207816,Senescent1_vs_Control1,0.35,0.264,N.S.,human pancreatic beta cells,in vitro,wildtype,human,Pancreatic
GSE214409,Senescent1_vs_Control1,-1.077,0.117,p<0.00001,primary human IMR90 fibroblasts,in vitro,c1 wildtype; s1 HRasV12 overexpression,human,Fibroblasts
GSE221104,Senescent1_vs_Control1,-1.354,0.168,p<0.00001,human WI-38 fibroblast cell line,in vitro,wildtype,human,Fibroblasts
GSE222400,Senescent1_vs_Control1,-1.001,0.216,p=0.00009,human lung fibroblast cells,in vitro,wildtype,human,Fibroblasts
GSE222400,Senescent2_vs_Control2,-0.79,0.191,p=0.00136,human lung fibroblast cells,in vitro,wildtype,human,Fibroblasts
GSE226005,Senescent1_vs_Control1,-0.51,0.19,p=0.01860,fibroblast cell line,in vitro,wildtype,human,Fibroblasts
GSE234417,Senescent1_vs_Control1,-0.713,0.152,p=0.00001,WI-38 cells,in vitro,wildtype,human,Fibroblasts
GSE235768,Senescent1_vs_Control1,0.586,0.259,N.S.,human normal skin fibroblasts,in vitro,wildtype,human,Fibroblasts
GSE235768,Senescent2_vs_Control2,0.297,0.263,N.S.,human normal skin fibroblasts,in vitro,wildtype,human,Fibroblasts
GSE235768,Senescent3_vs_Control3,0.479,0.231,N.S.,human normal lung fibroblasts,in vitro,wildtype,human,Fibroblasts
GSE235768,Senescent4_vs_Control4,-0.875,0.239,p=0.01065,human normal lung fibroblasts,in vitro,wildtype,human,Fibroblasts
GSE238252,Senescent1_vs_Control1,-0.948,0.471,N.S.,human lung fibroblast,in vitro,wildtype,human,Fibroblasts
GSE238254,Senescent1_vs_Control1,-0.781,0.215,p=0.00161,human lung fibroblast,in vitro,wildtype,human,Fibroblasts
GSE245045,Senescent1_vs_Control1,-0.709,0.281,N.S.,primary dermal fibroblast,in vitro,wildtype,human,Fibroblasts
GSE245147,Senescent1_vs_Control1,-0.727,0.107,p<0.00001,human nucleus pulposus cells,in vitro,wildtype,human,Musculoskeletal
GSE246073,Senescent1_vs_Control1,-0.017,0.416,N.S.,human astrocytes derived from hESC,in vitro,wildtype,human,Neural
GSE250224,Senescent1_vs_Control1,0.562,0.113,p<0.00001,human corneal endothelial cell,in vitro,wildtype,human,Endothelial
GSE250224,Senescent2_vs_Control1,-0.029,0.118,N.S.,human corneal endothelial cell,in vitro,wildtype,human,Endothelial
GSE251814,Senescent1_vs_Control1,0.073,0.231,N.S.,human induced pluripotent stem cells,in vitro,genetically edited (inducible CRISPRi targeting TERF2),human,Other
GSE264316,Senescent1_vs_Control1,-0.999,0.135,p<0.00001,human primary prostate stromal cell line,in vitro,wildtype,human,Stromal
GSE268487,Senescent1_vs_Control1,-1.091,0.172,p<0.00001,human lung fibroblasts,in vitro,wildtype,human,Fibroblasts
GSE269856,Senescent1_vs_Control1,-1.351,0.701,N.S.,human primary lung fibroblasts,in vitro,wildtype,human,Fibroblasts
GSE274295,Senescent1_vs_Control1,-1.488,0.17,p<0.00001,Human embryonic lung fibroblasts,in vitro,wildtype,human,Fibroblasts
GSE275256,Senescent1_vs_Control1,0.052,0.198,N.S.,human immortalized microglia cell line,in vitro,wildtype,human,Neural
GSE280365,Senescent1_vs_Control1,0.419,0.223,N.S.,lung fibroblasts,in vitro,WT,human,Fibroblasts
GSE287646,Senescent1_vs_Control1,-0.158,0.144,N.S.,human ASC52telo mesenchymal stem cells,in vitro,wildtype,human,Stromal
GSE294733,Senescent1_vs_Control1,0.676,0.389,N.S.,human umbilical vein endothelial cells,in vitro,wildtype,human,Endothelial
GSE294733,Senescent2_vs_Control1,0.02,0.395,N.S.,human umbilical vein endothelial cells,in vitro,wildtype,human,Endothelial
GSE56293,Senescent1_vs_Control1,-0.121,0.277,N.S.,human BJ foreskin fibroblasts,in vitro,wildtype,human,Fibroblasts
GSE58910,Senescent1_vs_Control1,0.118,0.184,N.S.,primary human astrocytes,in vitro,wildtype,human,Neural
GSE59966,Senescent1_vs_Control1,-0.431,0.247,N.S.,human mesenchymal stromal cells,in vitro,wildtype,human,Stromal
GSE60340,Senescent2_vs_Control1,-1.907,0.169,p<0.00001,MDAH041 LFS fibroblasts,in vitro,wildtype,human,Fibroblasts
GSE61130,Senescent1_vs_Control1,-0.853,0.121,p<0.00001,human IMR90 fibroblasts,in vitro,wildtype,human,Fibroblasts
GSE63577,Senescent3_vs_Control3,-0.747,0.329,N.S.,human HFF fibroblasts,in vitro,wildtype,human,Fibroblasts
GSE75643,Senescent1_vs_Control1,-1.648,0.314,p<0.00001,diploid embryonic lung fibroblasts,in vitro,c1 wildtype; s1 genetically edited (BRAF V600E overexpression),human,Fibroblasts
GSE94280,Senescent1_vs_Control1,-0.203,0.178,N.S.,human BJ fibroblast,in vitro,wildtype,human,Fibroblasts
GSE94395,Senescent1_vs_Control1,-1.167,0.158,p<0.00001,human fibroblasts (IMR90 cell line),in vitro,wildtype,human,Fibroblasts
GSE99028,Senescent1_vs_Control1,-1.085,0.462,N.S.,primary human fibroblasts,in vitro,wildtype,human,Fibroblasts
GSE133292,Senescent1_vs_Control1,-0.543,0.257,N.S.,human foreskin fibroblasts,in vitro,wildtype,human,Fibroblasts
GSE155371,Senescent1_vs_Control1,-0.12,0.193,N.S.,primary human oral keratinocytes,in vitro,wildtype,human,Epithelial
GSE165532,Senescent2_vs_Control2,-0.951,0.135,p<0.00001,human WI-38 fibroblast cell line,in vitro,wildtype,human,Fibroblasts
GSE230181,Senescent1_vs_Control1,-0.366,0.221,N.S.,s1 IMR90 cell line; s1 ADSC; c1 ADSC; s1 RPTEC; c1 RPTEC; s1 HUVEC; c1 HUVEC; s1 HMVEC; c1 HMVEC,in vitro,wildtype,human,Fibroblasts
GSE230181,Senescent8_vs_Control1,0.4,0.37,N.S.,IMR90 cell line,in vitro,wildtype,human,Fibroblasts
GSE230181,Senescent2_vs_Control1,-1.689,0.311,p<0.00001,IMR90 cell line,in vitro,wildtype,human,Fibroblasts
GSE230181,Senescent3_vs_Control1,-0.864,0.308,p=0.01406,IMR90 cell line,in vitro,wildtype,human,Fibroblasts
GSE230181,Senescent4_vs_Control1,-1.414,0.311,p=0.00004,IMR90 cell line,in vitro,wildtype,human,Fibroblasts
GSE230181,Senescent6_vs_Control1,0.023,0.371,N.S.,IMR90 cell line,in vitro,wildtype,human,Fibroblasts
GSE230181,Senescent7_vs_Control1,0.176,0.307,N.S.,IMR90 cell line,in vitro,wildtype,human,Fibroblasts
GSE230181,Senescent5_vs_Control1,-0.482,0.308,N.S.,IMR90 cell line,in vitro,wildtype,human,Fibroblasts
GSE230181,Senescent9_vs_Control1,0.249,0.332,N.S.,IMR90 cell line,in vitro,wildtype,human,Fibroblasts
GSE230358,Senescent1_vs_Control1,-0.446,0.147,p=0.01347,human IMR90 fibroblast cell line,in vitro,wildtype,human,Fibroblasts
GSE230358,Senescent8_vs_Control1,-0.818,0.294,p=0.03211,human IMR90 fibroblast cell line,in vitro,wildtype,human,Fibroblasts
GSE230358,Senescent2_vs_Control1,-1.826,0.298,p<0.00001,human IMR90 fibroblast cell line,in vitro,wildtype,human,Fibroblasts
GSE230358,Senescent3_vs_Control1,-2.225,0.301,p<0.00001,human IMR90 fibroblast cell line,in vitro,wildtype,human,Fibroblasts
GSE230358,Senescent4_vs_Control1,-0.874,0.237,p=0.00153,human IMR90 fibroblast cell line,in vitro,wildtype,human,Fibroblasts
GSE230358,Senescent6_vs_Control1,-2.163,0.308,p<0.00001,human IMR90 fibroblast cell line,in vitro,wildtype,human,Fibroblasts
GSE230358,Senescent7_vs_Control1,-0.095,0.236,N.S.,human IMR90 fibroblast cell line,in vitro,wildtype,human,Fibroblasts
GSE230358,Senescent5_vs_Control1,-1.973,0.297,p<0.00001,human IMR90 fibroblast cell line,in vitro,wildtype,human,Fibroblasts
GSE230358,Senescent9_vs_Control1,0.277,0.235,N.S.,human IMR90 fibroblast cell line,in vitro,wildtype,human,Fibroblasts
GSE295083,Senescent1_vs_Control1,-2.132,0.705,p=0.00790,human primary fibroblasts,in vitro,wildtype,human,Fibroblasts
GSE296209,Senescent1_vs_Control1,-0.6,0.162,p=0.00096,human primary prostate stromal cells,in vitro,wildtype,human,Stromal
GSE76605,Senescent1_vs_Control1,-1.168,0.263,p=0.00007,unknown,in vitro,c1 wildtype; s1 genetically edited (BRAF overexpression),human,Other
GSE84694,Senescent1_vs_Control1,-1.426,0.312,p=0.00003,human mesenchymal stem cells,in vitro,wildtype,human,Stromal
GSE85082,Senescent1_vs_Control1,-1.071,0.469,N.S.,unknown,in vitro,wildtype,human,Other
GSE216842,Senescent1_vs_Control1,-0.552,0.126,p=0.00005,human primary stromal cell line,in vitro,wildtype,human,Stromal
GSE216842,Senescent2_vs_Control2,-0.493,0.155,p=0.00359,human primary stromal cell line,in vitro,wildtype,human,Stromal
GSE216842,Senescent4_vs_Control4,-0.033,0.136,N.S.,human primary stromal cell line,in vitro,wildtype,human,Stromal
GSE252675,Senescent1_vs_Control1,-0.377,0.235,N.S.,human nucleus pulposus mesenchymal stem cells,in vitro,wildtype,human,Musculoskeletal
GSE280050,Senescent1_vs_Control1,-0.049,0.183,N.S.,human cardiac organoids,in vitro,wildtype,human,Other
