study,comparison,log2fc,lfcSE,padj,sample_type,origin,genotype,organism,simple_label
GSE53356,Senescent1_vs_Control1,1.041,0.053,p<0.00001,human IMR90 cell line,in vitro,wildtype,human,Fibroblasts
GSE247607,human_Senescent1_vs_Control1,-1.333,0.509,p=0.04083,human IMR-90 fibroblast cell line,in vitro,wildtype,human,Fibroblasts
GSE101750,Senescent1_vs_Control1,-1.649,0.178,p<0.00001,human IMR90 fibroblasts,in vitro,wildtype,human,Fibroblasts
GSE103938,Senescent2_vs_Control1,-1.358,0.988,N.S.,human IMR90 fibroblasts,in vitro,wildtype,human,Fibroblasts
GSE105937,Senescent1_vs_Control1,-0.315,0.286,N.S.,human IMR90 lung fibroblasts,in vitro,wildtype,human,Fibroblasts
GSE105937,Senescent2_vs_Control1,-0.625,0.262,p=0.04292,human IMR90 lung fibroblasts,in vitro,wildtype,human,Fibroblasts
GSE108278,Senescent1_vs_Control1,-1.342,0.216,p<0.00001,IMR90 hTERT lung fibroblast,in vitro,wildtype,human,Fibroblasts
GSE109700,Senescent1_vs_Control1,1.076,0.167,p<0.00001,human lung fibroblast cells,in vitro,wildtype,human,Fibroblasts
GSE118583,Senescent1_vs_Control1,0.268,0.134,N.S.,human lung fibroblast cell line IMR-90,in vitro,wildtype,human,Fibroblasts
GSE124609,Senescent1_vs_Control1,0.331,0.326,N.S.,human lung fibroblasts,in vitro,wildtype,human,Fibroblasts
GSE125632,Senescent1_vs_Control1,0.345,0.217,N.S.,human bone marrow mesenchymal stromal cells,in vitro,wildtype,human,Stromal
GSE128420,Senescent1_vs_Control1,-1.54,0.136,p<0.00001,primary normal human prostate stromal cells,in vitro,wildtype,human,Stromal
GSE130306,Senescent1_vs_Control1,0.833,0.085,p<0.00001,human WI-38 fibroblasts,in vitro,wildtype,human,Fibroblasts
GSE132204,Senescent1_vs_Control1,0.446,0.263,N.S.,primary human corneal endothelial cells,in vitro,wildtype,human,Endothelial
GSE132204,Senescent2_vs_Control2,1.001,0.262,p=0.00147,primary human corneal endothelial cells,in vitro,wildtype,human,Endothelial
GSE132370,Senescent1_vs_Control1,0.173,0.282,N.S.,human IMR90 fibroblasts,in vitro,wildtype,human,Fibroblasts
GSE144752,Senescent1_vs_Control1,-0.823,0.225,p=0.00094,BJ hTERT fibroblast,in vitro,wildtype,human,Fibroblasts
GSE153921,Senescent1_vs_Control1,-1.286,0.129,p<0.00001,human IMR90 ER:RAS cell line,in vitro,genetically edited (shRNA knockdown of XPO7),human,Fibroblasts
GSE155680,Senescent1_vs_Control1,0.884,0.122,p<0.00001,primary human umbilical vein endothelial cells,in vitro,wildtype,human,Endothelial
GSE155903,Senescent1_vs_Control1,-1.506,0.119,p<0.00001,IMR90 ER:RAS cell line,in vitro,genetically edited (ER:RAS),human,Fibroblasts
GSE156038,Senescent1_vs_Control1,0.267,0.107,p=0.02368,human prostate primary stromal cells,in vitro,wildtype,human,Stromal
GSE156184,Senescent1_vs_Control1,0.267,0.107,p=0.02314,Normal human prostate derived primary stromal cells,in vitro,wildtype,human,Stromal
GSE156472,Senescent1_vs_Control1,0.267,0.107,p=0.02311,primary human prostate stromal cells,in vitro,wildtype,human,Stromal
GSE157867,Senescent1_vs_Control1,0.091,0.324,N.S.,human umbilical vein endothelial cell,in vitro,wildtype,human,Endothelial
GSE160273,Senescent1_vs_Control1,-0.004,0.175,N.S.,human bone mesenchymal stem cells,in vitro,wildtype,human,Stromal
GSE160702,Senescent1_vs_Control1,-0.116,0.178,N.S.,human endometrial stromal cells,in vitro,wildtype,human,Stromal
GSE165406,Senescent1_vs_Control1,1.05,0.141,p<0.00001,human umbilical vein endothelial cells,in vitro,c1 wildtype; s1 genetically edited (siRNA knockdown of CCM2),human,Endothelial
GSE166035,Senescent1_vs_Control1,-0.278,0.105,p=0.02544,primary small airway epithelial cells,in vitro,wildtype,human,Epithelial
GSE166035,Senescent2_vs_Control2,0.082,0.091,N.S.,primary small airway epithelial cells,in vitro,wildtype,human,Epithelial
GSE166059,Senescent1_vs_Control1,-0.28,0.1,p=0.01303,human SAEC cells,in vitro,wildtype,human,Other
GSE166059,Senescent2_vs_Control2,0.135,0.1,N.S.,human SAEC cells,in vitro,wildtype,human,Other
GSE168994,Senescent1_vs_Control1,0.635,0.112,p<0.00001,human lung fibroblast,in vitro,wildtype,human,Fibroblasts
GSE171780,Senescent1_vs_Control1,0.562,0.113,p<0.00001,human fibroblast cell line IMR90,in vitro,wildtype,human,Fibroblasts
GSE176199,Senescent1_vs_Control1,-0.533,0.195,p=0.01374,human cartilage mesenchymal stromal cells,in vitro,wildtype,human,Chondrocytes
GSE176324,Senescent1_vs_Control1,-0.103,0.151,N.S.,primary human pancreatic islets,in vitro,wildtype,human,Pancreatic
GSE180361,Senescent1_vs_Control1,0.479,0.17,p=0.01280,human IMR90 fibroblasts,in vitro,s1 p16 overexpression; c1 wildtype,human,Fibroblasts
GSE180361,Senescent2_vs_Control2,-0.315,0.122,p=0.02095,human keratinocytes,in vitro,s2 HRAS G12V overexpression; c2 wildtype,human,Epithelial
GSE180406,Senescent1_vs_Control1,0.265,0.178,N.S.,human MRC-5 cell line,in vitro,wildtype,human,Other
GSE184892,Senescent1_vs_Control1,-1.165,0.18,p<0.00001,human primary fibroblast,in vitro,wildtype,human,Fibroblasts
GSE198396,Senescent1_vs_Control1,0.207,0.136,N.S.,human foreskin fibroblast cell line HCA2,in vitro,wildtype,human,Fibroblasts
GSE207816,Senescent1_vs_Control1,-0.077,0.499,N.S.,human pancreatic beta cells,in vitro,wildtype,human,Pancreatic
GSE214409,Senescent1_vs_Control1,-2.181,0.154,p<0.00001,primary human IMR90 fibroblasts,in vitro,c1 wildtype; s1 HRasV12 overexpression,human,Fibroblasts
GSE221104,Senescent1_vs_Control1,0.005,0.12,N.S.,human WI-38 fibroblast cell line,in vitro,wildtype,human,Fibroblasts
GSE222400,Senescent1_vs_Control1,0.108,0.206,N.S.,human lung fibroblast cells,in vitro,wildtype,human,Fibroblasts
GSE222400,Senescent2_vs_Control2,0.272,0.187,N.S.,human lung fibroblast cells,in vitro,wildtype,human,Fibroblasts
GSE226005,Senescent1_vs_Control1,0.445,0.153,p=0.00965,fibroblast cell line,in vitro,wildtype,human,Fibroblasts
GSE234417,Senescent1_vs_Control1,0.472,0.103,p=0.00001,WI-38 cells,in vitro,wildtype,human,Fibroblasts
GSE235768,Senescent1_vs_Control1,-1.273,0.369,p=0.00310,human normal skin fibroblasts,in vitro,wildtype,human,Fibroblasts
GSE235768,Senescent2_vs_Control2,-0.758,0.348,N.S.,human normal skin fibroblasts,in vitro,wildtype,human,Fibroblasts
GSE235768,Senescent3_vs_Control3,-0.5,0.348,N.S.,human normal lung fibroblasts,in vitro,wildtype,human,Fibroblasts
GSE235768,Senescent4_vs_Control4,-0.18,0.319,N.S.,human normal lung fibroblasts,in vitro,wildtype,human,Fibroblasts
GSE238252,Senescent1_vs_Control1,0.585,0.456,N.S.,human lung fibroblast,in vitro,wildtype,human,Fibroblasts
GSE238254,Senescent1_vs_Control1,0.025,0.321,N.S.,human lung fibroblast,in vitro,wildtype,human,Fibroblasts
GSE245045,Senescent1_vs_Control1,0.053,0.235,N.S.,primary dermal fibroblast,in vitro,wildtype,human,Fibroblasts
GSE245147,Senescent1_vs_Control1,0.217,0.162,N.S.,human nucleus pulposus cells,in vitro,wildtype,human,Musculoskeletal
GSE246073,Senescent1_vs_Control1,-0.996,0.571,N.S.,human astrocytes derived from hESC,in vitro,wildtype,human,Neural
GSE250224,Senescent1_vs_Control1,-0.812,0.128,p<0.00001,human corneal endothelial cell,in vitro,wildtype,human,Endothelial
GSE250224,Senescent2_vs_Control1,-0.37,0.124,p=0.00816,human corneal endothelial cell,in vitro,wildtype,human,Endothelial
GSE251814,Senescent1_vs_Control1,-0.07,0.173,N.S.,human induced pluripotent stem cells,in vitro,genetically edited (inducible CRISPRi targeting TERF2),human,Other
GSE264316,Senescent1_vs_Control1,0.82,0.129,p<0.00001,human primary prostate stromal cell line,in vitro,wildtype,human,Stromal
GSE268487,Senescent1_vs_Control1,0.988,0.178,p<0.00001,human lung fibroblasts,in vitro,wildtype,human,Fibroblasts
GSE269856,Senescent1_vs_Control1,-0.061,0.678,N.S.,human primary lung fibroblasts,in vitro,wildtype,human,Fibroblasts
GSE274295,Senescent1_vs_Control1,-1.233,0.175,p<0.00001,Human embryonic lung fibroblasts,in vitro,wildtype,human,Fibroblasts
GSE275256,Senescent1_vs_Control1,0.401,0.141,p=0.01282,human immortalized microglia cell line,in vitro,wildtype,human,Neural
GSE280365,Senescent1_vs_Control1,0.482,0.192,p=0.02207,lung fibroblasts,in vitro,WT,human,Fibroblasts
GSE287646,Senescent1_vs_Control1,-0.245,0.155,N.S.,human ASC52telo mesenchymal stem cells,in vitro,wildtype,human,Stromal
GSE294733,Senescent1_vs_Control1,1.547,0.525,p=0.01360,human umbilical vein endothelial cells,in vitro,wildtype,human,Endothelial
GSE294733,Senescent2_vs_Control1,0.794,0.529,N.S.,human umbilical vein endothelial cells,in vitro,wildtype,human,Endothelial
GSE56293,Senescent1_vs_Control1,-0.271,0.186,N.S.,human BJ foreskin fibroblasts,in vitro,wildtype,human,Fibroblasts
GSE58910,Senescent1_vs_Control1,0.633,0.324,N.S.,primary human astrocytes,in vitro,wildtype,human,Neural
GSE59966,Senescent1_vs_Control1,0.672,0.153,p=0.00025,human mesenchymal stromal cells,in vitro,wildtype,human,Stromal
GSE60340,Senescent2_vs_Control1,-1.664,0.216,p<0.00001,MDAH041 LFS fibroblasts,in vitro,wildtype,human,Fibroblasts
GSE61130,Senescent1_vs_Control1,-1.697,0.144,p<0.00001,human IMR90 fibroblasts,in vitro,wildtype,human,Fibroblasts
GSE63577,Senescent3_vs_Control3,0.672,0.225,p=0.01006,human HFF fibroblasts,in vitro,wildtype,human,Fibroblasts
GSE75643,Senescent1_vs_Control1,-0.814,0.219,p=0.00101,diploid embryonic lung fibroblasts,in vitro,c1 wildtype; s1 genetically edited (BRAF V600E overexpression),human,Fibroblasts
GSE94280,Senescent1_vs_Control1,0.022,0.118,N.S.,human BJ fibroblast,in vitro,wildtype,human,Fibroblasts
GSE94395,Senescent1_vs_Control1,0.253,0.143,N.S.,human fibroblasts (IMR90 cell line),in vitro,wildtype,human,Fibroblasts
GSE99028,Senescent1_vs_Control1,-1.496,0.469,p=0.02144,primary human fibroblasts,in vitro,wildtype,human,Fibroblasts
GSE133292,Senescent1_vs_Control1,-0.361,0.203,N.S.,human foreskin fibroblasts,in vitro,wildtype,human,Fibroblasts
GSE155371,Senescent1_vs_Control1,0.402,0.187,N.S.,primary human oral keratinocytes,in vitro,wildtype,human,Epithelial
GSE165532,Senescent2_vs_Control2,-1.573,0.122,p<0.00001,human WI-38 fibroblast cell line,in vitro,wildtype,human,Fibroblasts
GSE230181,Senescent1_vs_Control1,0.391,0.107,p=0.00139,s1 IMR90 cell line; s1 ADSC; c1 ADSC; s1 RPTEC; c1 RPTEC; s1 HUVEC; c1 HUVEC; s1 HMVEC; c1 HMVEC,in vitro,wildtype,human,Fibroblasts
GSE230181,Senescent8_vs_Control1,0.124,0.18,N.S.,IMR90 cell line,in vitro,wildtype,human,Fibroblasts
GSE230181,Senescent2_vs_Control1,0.316,0.149,N.S.,IMR90 cell line,in vitro,wildtype,human,Fibroblasts
GSE230181,Senescent3_vs_Control1,-0.183,0.15,N.S.,IMR90 cell line,in vitro,wildtype,human,Fibroblasts
GSE230181,Senescent4_vs_Control1,0.17,0.15,N.S.,IMR90 cell line,in vitro,wildtype,human,Fibroblasts
GSE230181,Senescent6_vs_Control1,0.152,0.18,N.S.,IMR90 cell line,in vitro,wildtype,human,Fibroblasts
GSE230181,Senescent7_vs_Control1,0.286,0.149,N.S.,IMR90 cell line,in vitro,wildtype,human,Fibroblasts
GSE230181,Senescent5_vs_Control1,-0.091,0.15,N.S.,IMR90 cell line,in vitro,wildtype,human,Fibroblasts
GSE230181,Senescent9_vs_Control1,0.063,0.161,N.S.,IMR90 cell line,in vitro,wildtype,human,Fibroblasts
GSE230358,Senescent1_vs_Control1,0.006,0.088,N.S.,human IMR90 fibroblast cell line,in vitro,wildtype,human,Fibroblasts
GSE230358,Senescent8_vs_Control1,-0.137,0.176,N.S.,human IMR90 fibroblast cell line,in vitro,wildtype,human,Fibroblasts
GSE230358,Senescent2_vs_Control1,0.094,0.175,N.S.,human IMR90 fibroblast cell line,in vitro,wildtype,human,Fibroblasts
GSE230358,Senescent3_vs_Control1,-0.181,0.176,N.S.,human IMR90 fibroblast cell line,in vitro,wildtype,human,Fibroblasts
GSE230358,Senescent4_vs_Control1,-0.608,0.142,p=0.00020,human IMR90 fibroblast cell line,in vitro,wildtype,human,Fibroblasts
GSE230358,Senescent6_vs_Control1,-0.885,0.183,p=0.00001,human IMR90 fibroblast cell line,in vitro,wildtype,human,Fibroblasts
GSE230358,Senescent7_vs_Control1,-0.168,0.142,N.S.,human IMR90 fibroblast cell line,in vitro,wildtype,human,Fibroblasts
GSE230358,Senescent5_vs_Control1,0.185,0.174,N.S.,human IMR90 fibroblast cell line,in vitro,wildtype,human,Fibroblasts
GSE230358,Senescent9_vs_Control1,-0.053,0.141,N.S.,human IMR90 fibroblast cell line,in vitro,wildtype,human,Fibroblasts
GSE295083,Senescent1_vs_Control1,-0.376,0.81,N.S.,human primary fibroblasts,in vitro,wildtype,human,Fibroblasts
GSE296209,Senescent1_vs_Control1,0.177,0.125,N.S.,human primary prostate stromal cells,in vitro,wildtype,human,Stromal
GSE76605,Senescent1_vs_Control1,-0.575,0.172,p=0.00375,unknown,in vitro,c1 wildtype; s1 genetically edited (BRAF overexpression),human,Other
GSE84694,Senescent1_vs_Control1,0.567,0.312,N.S.,human mesenchymal stem cells,in vitro,wildtype,human,Stromal
GSE85082,Senescent1_vs_Control1,-2.512,0.439,p<0.00001,unknown,in vitro,wildtype,human,Other
GSE216842,Senescent1_vs_Control1,-0.108,0.118,N.S.,human primary stromal cell line,in vitro,wildtype,human,Stromal
GSE216842,Senescent2_vs_Control2,-0.2,0.14,N.S.,human primary stromal cell line,in vitro,wildtype,human,Stromal
GSE216842,Senescent4_vs_Control4,-0.114,0.117,N.S.,human primary stromal cell line,in vitro,wildtype,human,Stromal
GSE252675,Senescent1_vs_Control1,-0.096,0.18,N.S.,human nucleus pulposus mesenchymal stem cells,in vitro,wildtype,human,Musculoskeletal
GSE280050,Senescent1_vs_Control1,0.515,0.204,p=0.02337,human cardiac organoids,in vitro,wildtype,human,Other
