study,comparison,log2fc,lfcSE,padj,sample_type,origin,genotype,organism,simple_label
GSE53356,Senescent1_vs_Control1,-9.448,2.161,p=0.00002,human IMR90 cell line,in vitro,wildtype,human,Fibroblasts
GSE101750,Senescent1_vs_Control1,1.399,0.969,N.S.,human IMR90 fibroblasts,in vitro,wildtype,human,Fibroblasts
GSE103938,Senescent2_vs_Control1,-0.864,1.463,N.S.,human IMR90 fibroblasts,in vitro,wildtype,human,Fibroblasts
GSE105937,Senescent2_vs_Control1,-2.017,2.394,N.S.,human IMR90 lung fibroblasts,in vitro,wildtype,human,Fibroblasts
GSE109700,Senescent1_vs_Control1,-1.923,2.14,N.S.,human lung fibroblast cells,in vitro,wildtype,human,Fibroblasts
GSE118583,Senescent1_vs_Control1,1.923,2.116,N.S.,human lung fibroblast cell line IMR-90,in vitro,wildtype,human,Fibroblasts
GSE125632,Senescent1_vs_Control1,-0.554,1.073,N.S.,human bone marrow mesenchymal stromal cells,in vitro,wildtype,human,Stromal
GSE128420,Senescent1_vs_Control1,4.352,1.993,p=0.04825,primary normal human prostate stromal cells,in vitro,wildtype,human,Stromal
GSE130306,Senescent1_vs_Control1,-2.447,1.954,N.S.,human WI-38 fibroblasts,in vitro,wildtype,human,Fibroblasts
GSE132204,Senescent1_vs_Control1,-0.239,0.821,N.S.,primary human corneal endothelial cells,in vitro,wildtype,human,Endothelial
GSE132204,Senescent2_vs_Control2,0.816,1.017,N.S.,primary human corneal endothelial cells,in vitro,wildtype,human,Endothelial
GSE132370,Senescent1_vs_Control1,-0.677,2.774,N.S.,human IMR90 fibroblasts,in vitro,wildtype,human,Fibroblasts
GSE153921,Senescent1_vs_Control1,-1.31,1.347,N.S.,human IMR90 ER:RAS cell line,in vitro,genetically edited (shRNA knockdown of XPO7),human,Fibroblasts
GSE155680,Senescent1_vs_Control1,0.908,1.009,N.S.,primary human umbilical vein endothelial cells,in vitro,wildtype,human,Endothelial
GSE155903,Senescent1_vs_Control1,1.237,1.16,N.S.,IMR90 ER:RAS cell line,in vitro,genetically edited (ER:RAS),human,Fibroblasts
GSE156038,Senescent1_vs_Control1,4.781,1.778,p=0.01429,human prostate primary stromal cells,in vitro,wildtype,human,Stromal
GSE156184,Senescent1_vs_Control1,4.78,1.778,p=0.01395,Normal human prostate derived primary stromal cells,in vitro,wildtype,human,Stromal
GSE156472,Senescent1_vs_Control1,4.78,1.778,p=0.01395,primary human prostate stromal cells,in vitro,wildtype,human,Stromal
GSE157867,Senescent1_vs_Control1,1.522,1.064,N.S.,human umbilical vein endothelial cell,in vitro,wildtype,human,Endothelial
GSE165406,Senescent1_vs_Control1,1.483,0.36,p=0.00024,human umbilical vein endothelial cells,in vitro,c1 wildtype; s1 genetically edited (siRNA knockdown of CCM2),human,Endothelial
GSE166035,Senescent1_vs_Control1,0.245,1.22,N.S.,primary small airway epithelial cells,in vitro,wildtype,human,Epithelial
GSE166035,Senescent2_vs_Control2,0.904,0.972,N.S.,primary small airway epithelial cells,in vitro,wildtype,human,Epithelial
GSE166059,Senescent1_vs_Control1,0.245,1.266,N.S.,human SAEC cells,in vitro,wildtype,human,Other
GSE166059,Senescent2_vs_Control2,0.759,1.168,N.S.,human SAEC cells,in vitro,wildtype,human,Other
GSE176199,Senescent1_vs_Control1,-0.493,1.374,N.S.,human cartilage mesenchymal stromal cells,in vitro,wildtype,human,Chondrocytes
GSE176324,Senescent1_vs_Control1,0.327,0.863,N.S.,primary human pancreatic islets,in vitro,wildtype,human,Pancreatic
GSE180361,Senescent2_vs_Control2,1.897,1.198,N.S.,human keratinocytes,in vitro,s2 HRAS G12V overexpression; c2 wildtype,human,Epithelial
GSE214409,Senescent1_vs_Control1,2.899,3.97,N.S.,primary human IMR90 fibroblasts,in vitro,c1 wildtype; s1 HRasV12 overexpression,human,Fibroblasts
GSE221104,Senescent1_vs_Control1,0.14,1.371,N.S.,human WI-38 fibroblast cell line,in vitro,wildtype,human,Fibroblasts
GSE234417,Senescent1_vs_Control1,-3.224,1.594,N.S.,WI-38 cells,in vitro,wildtype,human,Fibroblasts
GSE238254,Senescent1_vs_Control1,-2.214,1.147,N.S.,human lung fibroblast,in vitro,wildtype,human,Fibroblasts
GSE250224,Senescent1_vs_Control1,1.531,0.807,N.S.,human corneal endothelial cell,in vitro,wildtype,human,Endothelial
GSE250224,Senescent2_vs_Control1,0.636,0.854,N.S.,human corneal endothelial cell,in vitro,wildtype,human,Endothelial
GSE251814,Senescent1_vs_Control1,0.033,0.378,N.S.,human induced pluripotent stem cells,in vitro,genetically edited (inducible CRISPRi targeting TERF2),human,Other
GSE264316,Senescent1_vs_Control1,3.244,2.192,N.S.,human primary prostate stromal cell line,in vitro,wildtype,human,Stromal
GSE268487,Senescent1_vs_Control1,0.705,2.561,N.S.,human lung fibroblasts,in vitro,wildtype,human,Fibroblasts
GSE280365,Senescent1_vs_Control1,2.334,2.662,N.S.,lung fibroblasts,in vitro,WT,human,Fibroblasts
GSE287646,Senescent1_vs_Control1,-0.835,0.645,N.S.,human ASC52telo mesenchymal stem cells,in vitro,wildtype,human,Stromal
GSE294733,Senescent1_vs_Control1,-1.276,1.693,N.S.,human umbilical vein endothelial cells,in vitro,wildtype,human,Endothelial
GSE294733,Senescent2_vs_Control1,-4.725,1.976,N.S.,human umbilical vein endothelial cells,in vitro,wildtype,human,Endothelial
GSE60340,Senescent2_vs_Control1,0.118,1.642,N.S.,MDAH041 LFS fibroblasts,in vitro,wildtype,human,Fibroblasts
GSE61130,Senescent1_vs_Control1,0.735,1.708,N.S.,human IMR90 fibroblasts,in vitro,wildtype,human,Fibroblasts
GSE63577,Senescent3_vs_Control3,-1.5,2.096,N.S.,human HFF fibroblasts,in vitro,wildtype,human,Fibroblasts
GSE99028,Senescent1_vs_Control1,1.542,1.993,N.S.,primary human fibroblasts,in vitro,wildtype,human,Fibroblasts
GSE133292,Senescent1_vs_Control1,1.097,1.622,N.S.,human foreskin fibroblasts,in vitro,wildtype,human,Fibroblasts
GSE155371,Senescent1_vs_Control1,-0.27,0.384,N.S.,primary human oral keratinocytes,in vitro,wildtype,human,Epithelial
GSE165532,Senescent2_vs_Control2,0.892,1.222,N.S.,human WI-38 fibroblast cell line,in vitro,wildtype,human,Fibroblasts
GSE230181,Senescent1_vs_Control1,-1.749,0.8,N.S.,s1 IMR90 cell line; s1 ADSC; c1 ADSC; s1 RPTEC; c1 RPTEC; s1 HUVEC; c1 HUVEC; s1 HMVEC; c1 HMVEC,in vitro,wildtype,human,Fibroblasts
GSE230181,Senescent8_vs_Control1,-4.461,1.729,p=0.02729,IMR90 cell line,in vitro,wildtype,human,Fibroblasts
GSE230181,Senescent2_vs_Control1,-3.385,1.341,p=0.02519,IMR90 cell line,in vitro,wildtype,human,Fibroblasts
GSE230181,Senescent3_vs_Control1,-1.168,1.112,N.S.,IMR90 cell line,in vitro,wildtype,human,Fibroblasts
GSE230181,Senescent4_vs_Control1,-3.459,1.31,p=0.02176,IMR90 cell line,in vitro,wildtype,human,Fibroblasts
GSE230181,Senescent6_vs_Control1,-5.151,1.729,p=0.01028,IMR90 cell line,in vitro,wildtype,human,Fibroblasts
GSE230181,Senescent7_vs_Control1,-3.165,1.277,p=0.02948,IMR90 cell line,in vitro,wildtype,human,Fibroblasts
GSE230181,Senescent5_vs_Control1,-4.053,1.39,p=0.01012,IMR90 cell line,in vitro,wildtype,human,Fibroblasts
GSE230181,Senescent9_vs_Control1,-5.472,1.527,p=0.00137,IMR90 cell line,in vitro,wildtype,human,Fibroblasts
GSE230358,Senescent1_vs_Control1,-1.371,0.829,N.S.,human IMR90 fibroblast cell line,in vitro,wildtype,human,Fibroblasts
GSE230358,Senescent8_vs_Control1,-3.307,1.948,N.S.,human IMR90 fibroblast cell line,in vitro,wildtype,human,Fibroblasts
GSE230358,Senescent2_vs_Control1,-1.889,1.763,N.S.,human IMR90 fibroblast cell line,in vitro,wildtype,human,Fibroblasts
GSE230358,Senescent3_vs_Control1,-4.201,1.948,N.S.,human IMR90 fibroblast cell line,in vitro,wildtype,human,Fibroblasts
GSE230358,Senescent4_vs_Control1,-0.365,1.302,N.S.,human IMR90 fibroblast cell line,in vitro,wildtype,human,Fibroblasts
GSE230358,Senescent6_vs_Control1,-3.723,1.948,N.S.,human IMR90 fibroblast cell line,in vitro,wildtype,human,Fibroblasts
GSE230358,Senescent7_vs_Control1,-3.39,1.555,N.S.,human IMR90 fibroblast cell line,in vitro,wildtype,human,Fibroblasts
GSE230358,Senescent5_vs_Control1,-2.899,1.868,N.S.,human IMR90 fibroblast cell line,in vitro,wildtype,human,Fibroblasts
GSE230358,Senescent9_vs_Control1,-2.569,1.452,N.S.,human IMR90 fibroblast cell line,in vitro,wildtype,human,Fibroblasts
GSE296209,Senescent1_vs_Control1,-0.905,1.03,N.S.,human primary prostate stromal cells,in vitro,wildtype,human,Stromal
GSE76605,Senescent1_vs_Control1,0.373,1.324,N.S.,unknown,in vitro,c1 wildtype; s1 genetically edited (BRAF overexpression),human,Other
GSE216842,Senescent1_vs_Control1,3.526,1.804,N.S.,human primary stromal cell line,in vitro,wildtype,human,Stromal
GSE216842,Senescent2_vs_Control2,4.886,1.873,p=0.01883,human primary stromal cell line,in vitro,wildtype,human,Stromal
GSE216842,Senescent4_vs_Control4,2.477,1.91,N.S.,human primary stromal cell line,in vitro,wildtype,human,Stromal
GSE280050,Senescent1_vs_Control1,3.368,1.417,p=0.03345,human cardiac organoids,in vitro,wildtype,human,Other
