study,comparison,log2fc,lfcSE,padj,sample_type,origin,genotype,organism,simple_label
GSE130099,Senescent1_vs_Control1,0.769,1.447,N.S.,human BJ-TERT fibroblasts,in vitro,c1 genetically edited (TERT overexpression); s1 genetically edited (TERT overexpression; myrAKT1 overexpression),human,Fibroblasts
GSE212085,Senescent1_vs_Control1,-0.667,1.037,N.S.,human foetal lung fibroblast cell line IMR-90,in vitro,wildtype,human,Fibroblasts
GSE53356,Senescent1_vs_Control1,8.822,2.52,p=0.00075,human IMR90 cell line,in vitro,wildtype,human,Fibroblasts
GSE117979,Senescent1_vs_Control1,0.489,1.384,N.S.,mouse embryonic fibroblasts,in vitro,wildtype C57BL/6,mouse,Fibroblasts
GSE117979,Senescent2_vs_Control2,8.396,1.461,p<0.00001,c2 mouse embryonic fibroblasts; c2 mouse embryonic fibroblata; s2 mouse embryonic fibroblasts,in vitro,wildtype C57BL/6,mouse,Fibroblasts
GSE117979,Senescent3_vs_Control3,0,1.965,N.S.,mouse embryonic fibroblasts,in vitro,wildtype C57BL/6,mouse,Fibroblasts
GSE182731,Senescent2_vs_Control2,1.71,1.841,N.S.,primary mouse lung fibroblasts,in vitro,wildtype C57BL/6,mouse,Fibroblasts
GSE202032,Senescent1_vs_Control1,1.152,1.227,N.S.,mouse embryonic fibroblasts,in vitro,wildtype,mouse,Fibroblasts
GSE218683,Senescent2_vs_Control2,4.603,2.348,N.S.,mouse embryonic fibroblasts,in vitro,wildtype,mouse,Fibroblasts
GSE229010,Senescent1_vs_Control1,4.613,1.662,p=0.01042,primary mouse adult fibroblast,in vitro,wildtype,mouse,Fibroblasts
GSE233718,Senescent1_vs_Control1,1.265,1.927,N.S.,mouse proximal tubular epithelial cells,in vitro,wildtype C57BL/6Rj,mouse,Epithelial
GSE247975,Senescent1_vs_Control1,1.176,2.124,N.S.,mouse fibro-adipogenic progenitors,in vitro,wildtype C57BL/6,mouse,Stromal
GSE281894,Senescent1_vs_Control1,0.99,2.021,N.S.,podocytes,in vitro,wildtype,mouse,Renal
GSE103938,Senescent2_vs_Control1,-8.448,3.912,N.S.,human IMR90 fibroblasts,in vitro,wildtype,human,Fibroblasts
GSE105937,Senescent2_vs_Control1,3.936,2.727,N.S.,human IMR90 lung fibroblasts,in vitro,wildtype,human,Fibroblasts
GSE109700,Senescent1_vs_Control1,2.933,1.717,N.S.,human lung fibroblast cells,in vitro,wildtype,human,Fibroblasts
GSE128420,Senescent1_vs_Control1,4.039,2.112,N.S.,primary normal human prostate stromal cells,in vitro,wildtype,human,Stromal
GSE132204,Senescent2_vs_Control2,-0.361,0.892,N.S.,primary human corneal endothelial cells,in vitro,wildtype,human,Endothelial
GSE156038,Senescent1_vs_Control1,4.248,1.977,N.S.,human prostate primary stromal cells,in vitro,wildtype,human,Stromal
GSE156184,Senescent1_vs_Control1,4.248,1.976,N.S.,Normal human prostate derived primary stromal cells,in vitro,wildtype,human,Stromal
GSE156472,Senescent1_vs_Control1,4.248,1.976,N.S.,primary human prostate stromal cells,in vitro,wildtype,human,Stromal
GSE166035,Senescent2_vs_Control2,2.008,2.846,N.S.,primary small airway epithelial cells,in vitro,wildtype,human,Epithelial
GSE176199,Senescent1_vs_Control1,-2.811,0.922,p=0.00565,human cartilage mesenchymal stromal cells,in vitro,wildtype,human,Chondrocytes
GSE176324,Senescent1_vs_Control1,0.773,1.497,N.S.,primary human pancreatic islets,in vitro,wildtype,human,Pancreatic
GSE221104,Senescent1_vs_Control1,4.445,2.016,p=0.04677,human WI-38 fibroblast cell line,in vitro,wildtype,human,Fibroblasts
GSE250224,Senescent1_vs_Control1,1.66,1.393,N.S.,human corneal endothelial cell,in vitro,wildtype,human,Endothelial
GSE250224,Senescent2_vs_Control1,0.783,1.458,N.S.,human corneal endothelial cell,in vitro,wildtype,human,Endothelial
GSE251814,Senescent1_vs_Control1,1.728,0.784,N.S.,human induced pluripotent stem cells,in vitro,genetically edited (inducible CRISPRi targeting TERF2),human,Other
GSE264316,Senescent1_vs_Control1,3.85,1.994,N.S.,human primary prostate stromal cell line,in vitro,wildtype,human,Stromal
GSE268487,Senescent1_vs_Control1,0.43,2.601,N.S.,human lung fibroblasts,in vitro,wildtype,human,Fibroblasts
GSE275256,Senescent1_vs_Control1,1.869,0.941,N.S.,human immortalized microglia cell line,in vitro,wildtype,human,Neural
GSE60340,Senescent2_vs_Control1,-1.351,2.398,N.S.,MDAH041 LFS fibroblasts,in vitro,wildtype,human,Fibroblasts
GSE61130,Senescent1_vs_Control1,1.191,4.08,N.S.,human IMR90 fibroblasts,in vitro,wildtype,human,Fibroblasts
GSE155371,Senescent1_vs_Control1,-1.937,0.829,N.S.,primary human oral keratinocytes,in vitro,wildtype,human,Epithelial
GSE230181,Senescent1_vs_Control1,1.273,3.118,N.S.,s1 IMR90 cell line; s1 ADSC; c1 ADSC; s1 RPTEC; c1 RPTEC; s1 HUVEC; c1 HUVEC; s1 HMVEC; c1 HMVEC,in vitro,wildtype,human,Fibroblasts
GSE230181,Senescent3_vs_Control1,1.995,4.317,N.S.,IMR90 cell line,in vitro,wildtype,human,Fibroblasts
GSE230358,Senescent4_vs_Control1,2.602,4.402,N.S.,human IMR90 fibroblast cell line,in vitro,wildtype,human,Fibroblasts
GSE216842,Senescent1_vs_Control1,4.784,2.089,p=0.04167,human primary stromal cell line,in vitro,wildtype,human,Stromal
GSE216842,Senescent2_vs_Control2,3.18,2.34,N.S.,human primary stromal cell line,in vitro,wildtype,human,Stromal
GSE216842,Senescent4_vs_Control4,2.876,2.183,N.S.,human primary stromal cell line,in vitro,wildtype,human,Stromal
GSE280050,Senescent1_vs_Control1,3.157,0.989,p=0.00333,human cardiac organoids,in vitro,wildtype,human,Other
